type,title,director,cast,country,release_year,content_rating,duration,genre,description
TV Show,"Big Dreams, Small Spaces",None Listed,Monty Don,United Kingdom,2017,TV-G,3 Seasons,"British TV Shows, International TV Shows, Reality TV",Writer and presenter Monty Don helps England's budding horticulturists plant and grow the gardens of their dreams.
TV Show,The Frankenstein Chronicles,None Listed,"Sean Bean, Tom Ward, Richie Campbell, Vanessa Kirby, Ed Stoppard, Ryan Sampson, Robbie Gee, Anna Maxwell Martin, Elliot Cowan, Charlie Creed-Miles, Eloise Smyth, Samuel West",United Kingdom,2017,TV-MA,2 Seasons,"British TV Shows, Crime TV Shows, International TV Shows","A detective tracks what seems to be a killer with a taste for dismemberment in 1827 London, but the case leads in a far more terrifying direction."
TV Show,Borderline,None Listed,"David Avery, Jackie Clune, David Elms, Liz Kingsman, Jamie Michie",United Kingdom,2017,TV-14,2 Seasons,"British TV Shows, TV Comedies",A team of inept border agents tackles immigration issues at the fictional Northend Airport in this improvised mockumentary series.
TV Show,The Windsors,None Listed,"Harry Enfield, Haydn Gwynne, Hugh Skinner, Louise Ford, Richard Goulding, Matthew Cottle, Morgana Robinson, Celeste Dring, Katy Wix, Ellie White",United Kingdom,2017,TV-MA,2 Seasons,"British TV Shows, International TV Shows, TV Comedies",The all-too-public trials and tribulations of England's royal family are reimagined as an over-the-top comedic soap opera.
TV Show,Grand Designs,None Listed,Kevin McCloud,United Kingdom,2017,TV-14,2 Seasons,"British TV Shows, International TV Shows, Reality TV","Host Kevin McCloud presents people who take self-building houses to a new level, following every step of their ambitious plans from beginning to end."
TV Show,Paranoid,None Listed,"Indira Varma, Robert Glenister, Dino Fetscher, Neil Stuke, Christiane Paul, Lesley Sharp, Kevin Doyle",United Kingdom,2016,TV-14,1 Season,"British TV Shows, Crime TV Shows, International TV Shows","When a woman is brutally murdered on a playground, a group of detectives find themselves drawn into a dark conspiracy as they search for the killer."
TV Show,Mary Portas: Secret Shopper,None Listed,Mary Portas,United Kingdom,2016,TV-14,1 Season,"British TV Shows, International TV Shows, Reality TV",Retail consultant Mary Portas collaborates with Britain's most complained-about stores to help them better serve fed-up customers.
TV Show,Retribution,None Listed,"Georgina Campbell, Joe Dempsie, Adrian Edmondson, Steve Evets, Laura Fraser, Julie Graham, John Lynch, Gary Lewis, Juliet Stevenson, Joanna Vanderham",United Kingdom,2016,TV-MA,1 Season,"British TV Shows, Crime TV Shows, International TV Shows",A dark web of secrets and lies emerges when a newlywed couple is killed and detectives question their feuding families.
TV Show,Crazyhead,None Listed,"Cara Theobold, Susan Wokoma, Riann Steele, Arinzé Kene, Lewis Reeves, Tony Curran",United Kingdom,2016,TV-MA,1 Season,"British TV Shows, International TV Shows, TV Comedies",Bowling alley worker Amy and nonconformist Raquel kick some serious demon butt while also facing their inner demons as they navigate their early 20s.
TV Show,Meet the Adebanjos,None Listed,"Wale Ojo, Yetunde Oduwole, Andrea Aboagye, Daniel Davids, Moji Bamtefa, Jordan Coulson",United Kingdom,2016,TV-PG,3 Seasons,"British TV Shows, TV Comedies","In South London, tradition clashes with culture as a Nigerian father tries to instill his old-fashioned African values into his modern British family."
TV Show,Hoff the Record,Gordon Anderson,"David Hasselhoff, Asim Chaudhry, Fergus Craig, Mark Quartley, Ella Smith, Brett Goldstein",United Kingdom,2016,TV-MA,2 Seasons,"British TV Shows, TV Comedies","TV star David Hasselhoff hopes to reboot his career in the U.K., but both his comeback plans and his personal life keep going off the rails."
TV Show,Happy Valley,None Listed,"Sarah Lancashire, Siobhan Finneran, Charlie Murphy, James Norton, George Costigan, Karl Davies, Shane Zaza, Steve Pemberton, Joe Armstrong, Adam Long, Rick Warden, Rhys Connah, Katherine Kelly",United Kingdom,2016,TV-MA,2 Seasons,"British TV Shows, Crime TV Shows, International TV Shows","Yorkshire police sergeant Catherine Cawood pursues the man who assaulted her late daughter, unaware he is now part of a secret kidnapping plot."
TV Show,Great Interior Design Challenge,None Listed,"Tom Dyckhoff, Daniel Hopwood, Sophie Robinson",United Kingdom,2016,TV-PG,2 Seasons,"British TV Shows, International TV Shows, Reality TV","In this reality series, amateur interior designers on tight budgets test their mettle transforming rooms with speed and style."
TV Show,Hinterland,None Listed,"Richard Harrington, Mali Harries, Hannah Daniel, Alex Harries, Aneirin Hughes, Daniel Rochford",United Kingdom,2016,TV-14,3 Seasons,"British TV Shows, Crime TV Shows, International TV Shows","Forsaking London for the rustic landscapes of Wales, a police detective with a troubled soul finds himself in a place with secrets as dark as his own."
TV Show,London Spy,Jakob Verbruggen,"Ben Whishaw, Jim Broadbent, Edward Holcroft, Samantha Spiro, Charlotte Rampling, Lorraine Ashbourne, David Hayman, Clarke Peters, Adrian Lester, Harriet Walter",United Kingdom,2015,TV-MA,1 Season,"British TV Shows, Crime TV Shows, International TV Shows","When his reclusive-banker lover disappears, a hard-partying young British hedonist plunges into the dangerous world of espionage to find the truth."
TV Show,Derek,None Listed,"Ricky Gervais, Kerry Godliman, Karl Pilkington, David Earl, Kay Noone, Tim Barlow, Arthur Nightingale, Sheila Collings, Margaret Towner, Barry Martin, Prem Modgil, Blanche Williams, Ninette Finch, Brett Goldstein, Ruth Bratt, Holli Dempsey",United Kingdom,2015,TV-14,3 Seasons,"British TV Shows, International TV Shows, TV Comedies",Ricky Gervais created and stars in this heartwarming comedy-drama series as a loyal English nursing home caretaker who sees only the good in everyone.
TV Show,Bad Education,None Listed,"Jack Whitehall, Mathew Horne, Sarah Solemani, Michelle Gomez, Nikki Runeckles, Kae Alexander, Layton Williams, Ethan Lawrence, Charlie Wernham, Jack Binstead, Jack Bence, Harry Enfield",United Kingdom,2014,TV-MA,3 Seasons,"British TV Shows, TV Comedies","A history teacher at the posh Abbey Grove, Alfie Wickers is something truly special: He's his school's, if not England's, single worst educator."
TV Show,The Great Train Robbery,None Listed,"Luke Evans, Jim Broadbent, Paul Anderson, Martin Compston, Neil Maskell, Jack Roth, George Costigan, Robert Glenister, Nick Moran, Tim Pigott-Smith, James Fox, James Wilby, Jack Gordon, Nicholas Murchie, Del Synnott, Richard Hope, John Salthouse",United Kingdom,2013,NR,1 Season,"British TV Shows, Crime TV Shows, International TV Shows","This two-part tale delivers the true story of the Great Train Robbery of 1963, the biggest one in England's history."
TV Show,Love Your Garden,None Listed,"Alan Titchmarsh, David Domoney, Frances Tophill, Katie Rushworth",United Kingdom,2013,TV-G,1 Season,"British TV Shows, International TV Shows, Reality TV",Famed horticulturist Alan Titchmarsh hosts this uplifting show in which he and his team travel the U.K. planting dream gardens for deserving citizens.
TV Show,Burnistoun,None Listed,"Iain Connell, Robert Florence, Kirsty Strain, Richard Rankin, Allan Miller, Louise Stewart",United Kingdom,2012,TV-MA,2 Seasons,"British TV Shows, TV Comedies","This sketch series focuses on the eccentric characters in a small Scottish town, including bumbling cops, ""DJ Jesus"" and a disgruntled serial killer."
TV Show,Limmy's Show!,None Listed,"Brian Limond, Debbie Welsh, Tom Brogan, Raymond Mearns, Kirstin McLean",United Kingdom,2012,TV-MA,2 Seasons,"British TV Shows, TV Comedies","Scottish comic Brian ""Limmy"" Limond headlines this sketch series featuring him in various roles from a TV psychic to costumed adventurer ""Falconhoof."""
TV Show,Vexed,None Listed,"Toby Stephens, Miranda Raison, Lucy Punch, Nick Dunning, Rory Kinnear, Ronny Jhutti, Roger Griffiths, Patrick Baladi",United Kingdom,2012,TV-MA,2 Seasons,"British TV Shows, Crime TV Shows, International TV Shows",Charming slacker DI Jack Armstrong and driven professional DI Kate Bishop try to solve crimes together without driving each other crazy.
TV Show,Top Boy,None Listed,"Ashley Walters, Kane Robinson, Malcolm Kamulete, Shone Romulus, Sharon Duncan Brewster, Giacomo Mancini, Xavien Russell, Kierston Wareing, Geoff Bell, Nicholas Pinnock",United Kingdom,2011,TV-MA,2 Seasons,"British TV Shows, Crime TV Shows, International TV Shows","In this gritty, stylish drama series, two London drug dealers ply their lucrative trade at a public housing estate in North London."
TV Show,The Inbetweeners,None Listed,"Simon Bird, James Buckley, Blake Harrison, Joe Thomas, Greg Davies, Emily Head, Martin Trenaman, Belinda Stewart-Wilson, Robin Weaver, Henry Lloyd-Hughes",United Kingdom,2010,TV-MA,3 Seasons,"British TV Shows, TV Comedies",This rib-tickling series follows four English lads as they try – and fail spectacularly – to navigate the wretched no-man's land of adolescence.
TV Show,Chewin' the Fat,None Listed,"Ford Kiernan, Greg Hemphill, Karen Dunbar, Mark Cox, Paul Riley",United Kingdom,1999,TV-14,1 Season,"British TV Shows, TV Comedies","Petty criminals, dodgy decorators, full-bore Glaswegians and oddball documentary presenters converge in this sketch show that parodies Scottish life."
TV Show,Trailer Park Boys: The Animated Series,"Norm Hiscock, Gary Howsam, Mike Smith, John Paul Tremblay, Robb Wells","Mike Smith, John Paul Tremblay, Robb Wells, John Dunsworth, Pat Roach, Cory Bowles, Jacob Rolfe, Tyrone Parsons, Sarah Dunsworth, Jeanna Harrison, Marguerite McNeil",Canada,2019,TV-MA,1 Season,TV Comedies,"Nova Scotia’s favorite miscreants have always been super sketchy. Now, carrying on from the Season 12 finale, the boys have become complete cartoons."
TV Show,Northern Rescue,None Listed,"William Baldwin, Kathleen Robertson, Spencer MacPherson, Taylor Thorne, Amalia Williamson, Michelle Nolden, Peter MacNeill, Natalie Lisinska",Canada,2019,TV-14,1 Season,TV Dramas,"After the sudden death of his wife, search and rescue commander John West relocates with his three kids to his rural hometown of Turtle Island Bay."
TV Show,Bad Blood,None Listed,"Anthony LaPaglia, Kim Coates, Enrico Colantoni, Paul Sorvino, Maxim Roy, Brett Donahue, Michelle Mylett, Claudia Ferri, Tony Nappo",Canada,2019,TV-MA,2 Seasons,"Crime TV Shows, TV Dramas","This sprawling crime drama follows the true story of the Rizzuto family and its associates, who presided over organized crime in Montreal for decades."
TV Show,True and the Rainbow Kingdom,None Listed,"Michela Luci, Jamie Watson, Anna Claire Bartlam, Dante Zee, Eric Peterson",Canada,2019,TV-Y,3 Seasons,Kids' TV,"When something's wrong in the Rainbow Kingdom, bighearted guardian True and her best friend, Bartleby, are there to grant wishes and save the day."
TV Show,Kim's Convenience,None Listed,"Paul Sun-Hyung Lee, Jean Yoon, Andrea Bang, Simu Liu, Andrew Phung, Nicole Power",Canada,2019,TV-14,3 Seasons,TV Comedies,"While running a convenience store in Toronto, members of a Korean-Canadian family deal with customers, each other and the evolving world around them."
TV Show,Reboot: The Guardian Code,None Listed,"Ty Wood, Sydney Scotia, Ajay Friese, Gabriel Darku, Hannah Vandenbygaart, Timothy E. Brummund, Bob Frazer, Octavian Kaul, Nicholas Lea, Kirsten Robek, Alex Zahara",Canada,2018,TV-Y7-FV,2 Seasons,Kids' TV,Four tech-savvy teens hone their skills as cyber-superheroes in a series of secret missions to save the world.
TV Show,Heartland,None Listed,"Amber Marshall, Michelle Morgan, Graham Wardle, Shaun Johnston, Chris Potter, Jessica Amlee, Kerry James, Nathaniel Arcand",Canada,2017,TV-PG,11 Seasons,TV Dramas,Spunky teenager Amy is reeling from the sudden death of her mother when she and her grandfather are threatened with the loss of their horse ranch.
TV Show,Justin Time GO!,None Listed,"Drew Davis, Scott McCord, Jenna Warren",Canada,2016,TV-Y,1 Season,Kids' TV,"A young boy's imagination takes him throughout the world and history, where he learns life lessons and has tons of fun with two make-believe friends."
TV Show,Fangbone,None Listed,"Taylor Abrahamse, Colin Doyle, Juan Chioran, Kathleen Laskey, Stacey DePass, Mike Kiss",Canada,2016,TV-Y7,1 Season,"Kids' TV, TV Comedies","Magically transported from far-off Skullbania, a young barbarian teams up with an odd third-grader to protect his homeland from an evil sorcerer."
TV Show,Highway Thru Hell,None Listed,"Dave Pettitt, Jamie Davis, Adam Gazzola, Kevin Ritchie",Canada,2016,TV-PG,3 Seasons,Reality TV,"On the hazardous highways of Canada's interior, heavy vehicle towing companies experience hardship and triumph rescuing wrecked and stranded trucks."
TV Show,Sensitive Skin,None Listed,"Kim Cattrall, Don McKellar, Nicolas Wright, Joanna Gleason, Colm Feore, Clé Bennett, Bob Martin, Elliott Gould",Canada,2016,TV-MA,1 Season,TV Comedies,Davina and Al try to revamp their lives as they struggle with the uncertainties of middle age in this darkly comic adaptation of the British hit.
TV Show,Ever After High,None Listed,"Jonquil Goode, Karen Strassman, Audu Paden, Julie Maddalena, Marieve Herington, Rena Strober, Evan Smith, Wendee Lee, Haviland Stillwell, Valerie Arem, Cam Clarke, Colleen Foy, Cindy Robinson, Joe Sanfelippo, Jamieson Price, Debi Derryberry, Lindsey Ames, Rajo Zakic, Erin Fitzgerald, Malcolm Danare",Canada,2016,TV-Y7,5 Seasons,Kids' TV,The kids of fairy-tale characters attend a school with two cliques: those who accept their fairy-tale destinies and those who want to write their own.
TV Show,Some Assembly Required,None Listed,"Kolton Stewart, Harrison Houde, Charlie Storwick, Sydney Scotia, Travis Turner, Ellie Harvie, Dylan Playfair",Canada,2015,TV-G,2 Seasons,"Kids' TV, TV Comedies",A 14-year-old takes ownership of a toy company and hires a group of his friends to help him create amazing new toys.
TV Show,License to Drill: Louisiana,None Listed,None Listed,Canada,2014,TV-PG,1 Season,Reality TV,"A crew of oil riggers work an off-season job and swap the blistering cold of their native Canada for sunny, Southern comfort in the Big Easy."
TV Show,Mr. Young,None Listed,"Brendan Meyer, Matreya Fedor, Gig Morton, Kurt Ostlund, Emily Tennant, Milo Shandel",Canada,2013,TV-G,2 Seasons,"Kids' TV, TV Comedies","After Adam graduates from college at age 14, he heads back to high school to teach science, where his crush and his best friends are his students!"
TV Show,My Babysitter's a Vampire,None Listed,"Matthew Knight, Vanessa Morgan, Atticus Mitchell, Cameron Kennedy, Kate Todd, Ari Cohen",Canada,2012,TV-PG,2 Seasons,"Kids' TV, TV Comedies","Ethan, Benny and fledgling vampire Sarah battle zombies, demons and the other supernatural beasties that regularly threaten their school."
TV Show,Justin Time,None Listed,"Gage Munroe, Scott McCord, Jenna Warren",Canada,2012,TV-Y,2 Seasons,Kids' TV,"In Justin's dreams, he and his imaginary friends Olive and Squidgy travel around the world learning about nature and other cultures."
TV Show,Bo on the Go!,None Listed,"Catherine O'Connor, Andrew Sabiston, Jim Fowler",Canada,2007,TV-Y,1 Season,Kids' TV,"Staying at home doesn't mean sitting still for energetic Bo and her little dragon friend Dezzy, who embark on amazing adventures through movement."
TV Show,Intelligence,None Listed,"Ian Tracey, Klea Scott, John Cassini, Matt Frewer, Alana Husband, Kyla Wise, Camille Sullivan, Darcy Laurie, Eugene Lipinski, Michael Eklund",Canada,2007,TV-14,2 Seasons,"Crime TV Shows, TV Dramas",Clashes both on the street and in the bedroom pits the female head of the Organized Crime Unit against the cocky leader of a pot-smuggling ring.
Movie,Bulletproof 2,Don Michael Paul,"Faizon Love, Kirk Fox, Tony Todd, Pearl Thusi, Cassie Clare, Fiona Ramsey, Neels Clasen, Roxy Nel",United States,2020,TV-MA,97 min,"Action & Adventure, Comedies",A special agent abruptly reunites with a criminal – once a former friend – when he attempts to use his identity to infiltrate and take down a cartel.
Movie,The World We Make,Brian Baugh,"Caleb Castille, Rose Reid, Kevin Sizemore, Gregory Alan Williams",United States,2019,PG,108 min,"Dramas, Romantic Movies","A teenage equestrian and a local football player for each other, but simmering racism in their small town puts their relationship to the test."
Movie,Inside Man: Most Wanted,Michael J. Bassett,"Aml Ameen, Rhea Seehorn, Roxanne McKee, Urs Rechn, Akshay Kumar, Tanya van Graan, Andre Jacobs, Sven Ruygrok",United States,2019,R,106 min,Action & Adventure,A hotshot NYPD negotiator butts heads with the FBI and meets his match in a meticulous criminal mastermind as she attempts to rob the Federal Reserve.
Movie,Between Two Ferns: The Movie,Scott Aukerman,"Zach Galifianakis, Lauren Lapkus, Ryan Gaul, Jiavani Linayao, Will Ferrell",United States,2019,TV-MA,83 min,Comedies,"Armed with awkward questions and zero self-awareness, Zach Galifianakis hits the road to find famous interview subjects for his no-budget talk show."
Movie,Daddy Issues,Amara Cash,"Madison Lawlor, Montana Manning, Andrew Pifko, Monte Markham, Kamala Jones, Jodi Carol Harrison, Seth Cassell, Ronnie Clark, Lissa Danshaw, J.J. Hawkins",United States,2019,TV-MA,82 min,"Dramas, Independent Movies, LGBTQ Movies","Maya finally hooks up with her online dream girl, only to discover she’s deeply involved with an older sugar daddy – a man Maya knows all too well."
Movie,The Outsider,Timothy Woodward Jr.,"Jon Foo, Trace Adkins, Sean Patrick Flanery, Kaiwi Lyman, Nelli Tsay, Danny Trejo, Mitchell L. Johnson, Philip V. Bruenn",United States,2019,TV-MA,86 min,Movies,A frontier sheriff tries to protect his sadistic son from a Chinese railroad worker hellbent on revenge.
Movie,American Warfighter,Jerry G. Angelo,"Jerry G. Angelo, Paul Logan, Joshua Santana, Carolina Castro, David Robbins, Michael King, Tom Crisp, Jennifer Marshall, Victoria Clare, Ryan Baumann, Isaac C. Singleton Jr., Said Faraj",United States,2019,TV-MA,106 min,Dramas,"A Navy SEAL haunted by wartime memories tries to rebuild his life at home, even as one last mission threatens to unravel everything."
Movie,Deviant Love,Michael Feifer,"Emma Bell, Nick Ballard, Bradley Bundlie, Gail O'Grady, Corbin Timbrook, Kate Lang Johnson, Robert Adamson, Caia Coley, Alicia James, Sotida Arpon",United States,2019,TV-14,87 min,Thrillers,"In a tailspin after her marriage collapses, Jamie falls for a helpful gentleman whose interest in her welfare hides sinister motives."
Movie,After,Jenny Gage,"Josephine Langford, Hero Fiennes Tiffin, Selma Blair, Inanna Sarkis, Shane Paul McGhie, Pia Mia, Khadijha Red Thunder, Dylan Arnold, Samuel Larsen, Jennifer Beals, Peter Gallagher",United States,2019,PG-13,106 min,"Dramas, Romantic Movies","Wholesome college freshman Tessa Young thinks she knows what she wants out of life, until she crosses paths with complicated bad boy Hardin Scott."
Movie,Home Is Where the Killer Is,Kaila York,"Stacy Haiduk, Kelly Kruger, Christopher Sean, Anne Leighton, Beth Littleford, John-Paul Lavoisier, Kristoff St. John, Pallavi Sastry",United States,2019,TV-14,87 min,"Dramas, Thrillers","Recovering from cancer, a young woman thinks she’s found a friend when she rents a room from a caring ex-doctor. But empathy soon becomes obsession."
Movie,The Spooky Tale of Captain Underpants Hack-a-ween,None Listed,"Nat Faxon, Jay Gragnani, Ramone Hamilton, Sean Astin, Dayci Brookshire, Clancy Brown, Jorge Diaz, Peter Hastings, Evan Kishiyama, David Koechner, Erica Luttrell, Patty Mattson, Brennan Murray, Kevin Michael Richardson, Mindy Sterling, Stephen Tobolowsky, Kari Wahlgren",United States,2019,TV-Y7,46 min,"Children & Family Movies, Comedies","When Melvin tries to cancel Halloween, clever best friends Harold and George create their own spooky holiday – and it's a huge success!"
Movie,Super Monsters: Vida's First Halloween,"Jacob Joice, Steve Ball","Gigi Saul Guerrero, Elyse Maloway, Vincent Tong, Erin Mathews, Andrea Libman, Alessandro Juliani, Nicole Anthony, Diana Kaarina, Ian James Corlett, Britt McKillip, Kathleen Barr",United States,2019,TV-Y,24 min,Children & Family Movies,"The Super Monsters share their Halloween traditions with Vida, then get invited to a Día de los Muertos party in the Howlers' backyard."
Movie,The Last Whistle,Rob Smat,"Brad Leland, Jim O'Heir, Deanne Lauvin, Les Miles, Eric Nelsen, Fred Tolliver Jr, Tyler Perez, Sainty Nelsen",United States,2019,PG,88 min,"Dramas, Sports Movies","After a star player dies during football practice, his coach’s career and reputation are on the line as he refuses to quit his win-at-all-costs style."
Movie,Dolemite Is My Name,Craig Brewer,"Eddie Murphy, Wesley Snipes, Keegan-Michael Key, Mike Epps, Craig Robinson, Tituss Burgess, Da'Vine Joy Randolph, Kodi Smit-McPhee",United States,2019,R,118 min,"Comedies, Dramas","In 1970s LA, struggling comedian Rudy Ray Moore hits it big with his raunchy alter ego, Dolemite, then risks it all to take his act to the big screen."
Movie,Eli,Ciarán Foy,"Charlie Shotwell, Lili Taylor, Kelly Reilly, Max Martini, Sadie Sink, Deneen Tyler, Katia Gomez",United States,2019,TV-MA,98 min,Horror Movies,"With his desperate parents in tow, an 11-year-old boy with a debilitating illness checks into an isolated clinic to undergo experimental therapy."
Movie,The Laundromat,Steven Soderbergh,"Meryl Streep, Gary Oldman, Antonio Banderas, Sharon Stone, James Cromwell, Jeffrey Wright, Melissa Rauch, Jeff Michalski, Jane Morris, Robert Patrick, David Schwimmer",United States,2019,R,96 min,"Comedies, Dramas","When a widow gets swindled out of insurance money, her search for answers leads to two cunning lawyers in Panama who hide cash for the superrich."
Movie,El Camino: A Breaking Bad Movie,Vince Gilligan,Aaron Paul,United States,2019,TV-MA,123 min,"Dramas, Thrillers","Fugitive Jesse Pinkman attempts to outrun his past. Written and directed by ""Breaking Bad"" creator Vince Gilligan, starring Aaron Paul."
Movie,Fractured,Brad Anderson,"Sam Worthington, Lily Rabe, Stephen Tobolowsky, Adjoa Andoh, Lucy Capri, Lauren Cochrane, Shane Dean",United States,2019,TV-MA,100 min,Thrillers,"After his wife and injured daughter disappear from an ER, a man conducts a panicked search and becomes convinced the hospital is hiding something."
Movie,Burning Cane,Phillip Youmans,"Wendell Pierce, Karen Kaia Livers, Dominique McClellan, Braelyn Kelly, Emyri Crutchfield, Cynthia Capers, Erika Woods",United States,2019,TV-MA,78 min,Dramas,"A small-town Louisiana minister and one of his parishioners cope with grief, alcoholism and a crisis of faith in this dramatic character study."
Movie,Undercover Brother 2,Leslie Small,"Michael Jai White, Vince Swann, Barry Bostwick, Laila Odom, Gary Owen, Affion Crockett, Steven Lee Johnson, Lindsay Lamb, Zac Zedalis, Cj Sykes",United States,2019,R,85 min,Comedies,"When a beloved secret agent falls deep into a coma, his bumbling brother must defend their community from a divisive political threat."
Movie,The Irishman,Martin Scorsese,"Robert De Niro, Al Pacino, Joe Pesci, Harvey Keitel, Ray Romano, Bobby Cannavale, Anna Paquin, Stephen Graham, Stephanie Kurtzuba, Kathrine Narducci, Welker White, Jesse Plemons, Jack Huston, Domenick Lombardozzi, Louis Cancelmi, Paul Herman, Gary Basaraba, Marin Ireland, Sebastian Maniscalco, Steven Van Zandt",United States,2019,R,209 min,Dramas,Hit man Frank Sheeran looks back at the secrets he kept as a loyal member of the Bufalino crime family in this acclaimed film from Martin Scorsese.
Movie,Super Monsters Save Christmas,Steve Ball,"Elyse Maloway, Vincent Tong, Erin Mathews, Andrea Libman, Alessandro Juliani, Nicole Anthony, Diana Kaarina, Ian James Corlett, Britt McKillip, Kathleen Barr, Gigi Saul Guerrero, Brian Drummond",United States,2019,TV-Y,24 min,Children & Family Movies,"It's Christmas Eve in Pitchfork Pines, and the Super Monsters are joining forces to deck the halls, find Santa's missing reindeer and save the holiday!"
Movie,Awake,"Aleksandr Chernyaev, Fedor Lyass","Jonathan Rhys Meyers, Francesca Eastwood, Malik Yoba, William Forsythe, James Austin Kerr, Jeremy Parr",United States,2019,TV-MA,92 min,Thrillers,"After an accident leaves him with no recollection of who he is, a man becomes a prime suspect in the search for a serial killer targeting young women."
Movie,Earthquake Bird,Wash Westmoreland,"Alicia Vikander, Riley Keough, Naoki Kobayashi, Jack Huston, Kiki Sukezane, Yoshiko Sakuma, Ken Yamamura, Kazuhiro Muroyama, Akiko Iwase, Crystal Kay",United States,2019,R,107 min,"Dramas, Romantic Movies","In 1980s Tokyo, an enigmatic expat is suspected of killing her friend, who's gone missing in the wake of their love triangle with a local photographer."
Movie,Submission,J.M. Berrios,"Scott Pryor, Darrin Dewitt Henson, Eric Roberts, Kevin Sizemore, Lorynn York, John Gray, Sara McMann, Ovince Saint Preux",United States,2019,TV-MA,95 min,"Action & Adventure, Dramas","After a near-death trip home, a Marine looking to help his comrade survive returns to the underground world of MMA, where new battles await."
Movie,American Son,Kenny Leon,"Kerry Washington, Steven Pasquale, Jeremy Jordan, Eugene Lee",United States,2019,TV-MA,90 min,Dramas,Time passes and tension mounts in a Florida police station as an estranged interracial couple awaits news of their missing teenage son.
Movie,Christmas Break-In,Michael Kampa,"Danny Glover, Denise Richards, Cameron Seely, Sean O'Bryan, Katrina Begin, Jake Van Wagoner, Douglas Spain, Dawson Ehlke",United States,2019,TV-PG,87 min,"Children & Family Movies, Comedies","Stranded at school before holiday break, a precocious girl gets into the spirit of saving when a trio of robbers trespass and hold the janitor hostage."
