type,title,director,cast,country,release_year,content_rating,duration,genre,description
Movie,I Don't Feel at Home in This World Anymore,Macon Blair,"Melanie Lynskey, Elijah Wood, David Yow, Jane Levy, Devon Graye, Christine Woods, Robert Longstreet, Gary Anthony Williams",United States,2017,TV-MA,97 min,"Dramas, Independent Movies, Thrillers",A timid nursing assistant gets a new lease on life when she and a neighborhood loner track down the degenerates who broke into her house.
Movie,The Bachelors,Kurt Voelker,"J.K. Simmons, Josh Wiggins, Julie Delpy, Odeya Rush, Kevin Dunn, Kimberly Crandall, Jean Louisa Kelly, Charlie DePew, Tyrel Jackson Williams, Tom Amandes, Spencer List, Jacqueline Mazarella, Vanessa Howard, Harold Perrineau",United States,2017,TV-14,100 min,Dramas,"After the death of his wife, a teacher and his son move to a new city, where emotional connections with two women help them begin to heal."
Movie,Dismissed,Benjamin Arfmann,"Kent Osborne, Dylan Sprouse, Rae Gray, Alycia Delmore, Robert Longstreet, Chris Bauer, Randall Park, Mitchell Edwards, Victoria Zeutzius, Leslie Thurston, Matthew J. Evans",United States,2017,TV-14,87 min,Thrillers,An intelligent but intense honor student traumatizes his high school teacher and mentor when he doesn't get the grade he believes he deserves.
Movie,Blood Money,Lucky McKee,"John Cusack, Ellar Coltrane, Willa Fitzgerald, Jacob Artist, Ned Bellamy, Antonio Bell, Johanna McGinley",United States,2017,R,85 min,Action & Adventure,Three friends on a wilderness trip find bags full of cash and must evade the criminal who hid the money in the first place.
Movie,The Super,Stephan Rick,"Patrick John Flueger, Val Kilmer, Louisa Krause, Mattea Conforti, Taylor Richardson, Paul Ben-Victor, Yul Vazquez, Andrea Lynn Green, Travaris Spears, Melissa Bolona",United States,2017,R,89 min,Horror Movies,"When an ex-cop becomes a superintendent of an apartment building, he suspects the sinister janitor is behind the eerie disappearances of its tenants."
Movie,The Detained,Blair Hayes,"Alex Frnka, Sarah Davenport, Henry Zaga, Coy Stewart, Jennifer Robyn Jacobs, Gillian Vigman, Kevin Blake",United States,2017,TV-MA,85 min,"Horror Movies, Thrillers",Five high school students serving Saturday detention in a former corrections facility must find a way to outsmart an unseen menace out to kill them.
Movie,Grass,Tanuj Chopra,"Emily Chang, Pia Shah, Anthony Ma",United States,2017,TV-MA,57 min,"Comedies, Independent Movies",Good girl Cam recruits her pot-loving bestie Jinky to help deliver a backpack full of weed for her drug-dealing fiancé.
Movie,Girlfriend's Day,Michael Paul Stephenson,"Bob Odenkirk, Amber Tamblyn, Natasha Lyonne, Alex Karpovsky, Stacy Keach, Andy Richter, Ed Begley Jr., David Sullivan, Larry Fessenden, June Diane Raphael, Rich Sommer, Steven Michael Quezada, Echo Kellum, Stephanie Courtney, Toby Huss, Tucker Smallwood, Kevin O'Grady, Nate Mooney",United States,2017,TV-MA,71 min,"Comedies, Independent Movies","When he's caught up in a deadly conspiracy, an unemployed greeting card writer must create the perfect card for a new holiday to save his skin."
Movie,LEGO Marvel Super Heroes: Guardians of the Galaxy,None Listed,None Listed,United States,2017,TV-Y7-FV,22 min,Children & Family Movies,"The Guardians are on a mission to deliver the Build Stone to the Avengers before the Ravagers, Thanos and his underlings steal it from them."
Movie,Gender Revolution: A Journey with Katie Couric,None Listed,Katie Couric,United States,2017,TV-PG,90 min,"Documentaries, LGBTQ Movies","Katie Couric explores our evolving understanding of gender identity, speaking with transgender and intersex individuals about their experiences."
Movie,Newness,Drake Doremus,"Nicholas Hoult, Laia Costa, Danny Huston, Courtney Eaton, Matthew Gray Gubler, Albert Hammond Jr.",United States,2017,TV-MA,117 min,"Dramas, Independent Movies, Romantic Movies","Martin and Gabi try to form a relationship after meeting through a hookup app, but when boredom creeps in, they seek out an unconventional solution."
Movie,El Camino Christmas,David E. Talbert,"Jessica Alba, Tim Allen, Dax Shepard, Vincent D'Onofrio, Luke Grimes, Kurtwood Smith, Michelle Mylett",United States,2017,TV-MA,89 min,"Comedies, Dramas","Stuck in a liquor store during an alleged robbery, a group of strangers shares hidden truths and forms an unexpected bond on Christmas Eve."
Movie,Mr. Roosevelt,Noël Wells,"Noël Wells, Nick Thune, Britt Lower, Daniella Pineda, Andre Hyland, Armen Weitzman, Sergio Cilli",United States,2017,R,91 min,"Comedies, Independent Movies","A struggling comedian returns to Austin, Texas, to see her ailing cat and face her messy past – while staying with her ex and his new girlfriend."
Movie,Bright,David Ayer,"Will Smith, Joel Edgerton, Noomi Rapace, Lucy Fry, Edgar Ramírez, Ike Barinholtz, Brad William Henke, Enrique Murciano, Happy Anderson, Kenneth Choi, Andrea Navedo, Dawn Olivieri",United States,2017,TV-MA,118 min,"Action & Adventure, Sci-Fi & Fantasy","In an LA rife with interspecies tensions, a human cop and his orc partner stumble on a powerful object and become embroiled in a prophesied turf war."
Movie,You Can’t Fight Christmas,Kenny Young,"Brely Evans, Andra Fuller, Persia White, Porscha Coleman, Travis Winfrey, Nathan Davis Jr., Dedrick Bonner, Matthew Jones, Larry Poindexter, Richard Gant, Marla Gibbs",United States,2017,TV-PG,85 min,"Comedies, Romantic Movies","After stepping in to revitalize his family's hotel, a money-minded businessman clashes with the hotel's cheery, Christmas-loving decorator."
Movie,Some Freaks,Ian MacAllister-McDonald,"Thomas Mann, Lily Mae Harrington, Ely Henry, Lachlan Buchanan, Marin Ireland, John Thorsen, Stephen Thorne, Shannon Hartman",United States,2017,TV-MA,97 min,"Dramas, Romantic Movies","A one-eyed boy and plus-sized girl form a deep connection. But following a brief separation, they reunite as different people."
Movie,Pottersville,Seth Henrikson,"Michael Shannon, Judy Greer, Thomas Lennon, Ron Perlman, Christina Hendricks, Ian McShane",United States,2017,PG-13,86 min,"Comedies, Independent Movies","A man's drunken romp in a gorilla suit gets him mistaken for Bigfoot, drawing media attention and tourist dollars to his struggling small town."
Movie,The Hatred,Michael G. Kehoe,"Sarah Davenport, Andrew Divoff, Gabrielle Bourne, Bayley Corman, Alisha Wainwright, Nina Siemaszko, Shae Smolik, David Naughton, Amanda Wyss, Darby Walker",United States,2017,R,94 min,Horror Movies,Four young women head to a country house for an idyllic weekend retreat. But what lies in store for them is far from the dreamy getaway they imagined.
Movie,Susanne Bartsch: On Top,"Anthony Caronna, Alexander Smith",Susanne Bartsch,United States,2017,TV-MA,86 min,"Documentaries, LGBTQ Movies","Beyond her larger-than-life persona, this documentary reveals the woman behind the famed event planner, and her legacy as a cultural icon and activist."
Movie,A StoryBots Christmas,"Evan Spiridellis, Jeff Gill","Edward Asner, Judy Greer, Erin Fitzgerald, Fred Tatasciore, Jeff Gill, Gregg Spiridellis, Evan Spiridellis, Jim Meskimen, Nate Theis",United States,2017,TV-Y,26 min,Movies,"Bo thinks her holiday gift-giving isn't good enough, so she heads north to study under Santa Claus – only to find he's missing."
Movie,Black Site Delta,Jesse Gustafson,"Cam Gigandet, Teri Reeves, Michael Dale, Dion Mucciacito, Casey Hendershot, Benjamin Charles Watson, John Brodsky, Arash Mokhtar",United States,2017,TV-MA,88 min,Action & Adventure,"After discovering that their secret military prison is under attack by terrorists, a ragtag group of inmates does their best to neutralize the enemy."
Movie,Bring It On: Worldwide Showdown,Robert Adetuyi,"Cristine Prosperi, Jordan Rodrigues, Gia Re, Sophie Vavasseur, Sven Ruygrok, Stephan Lee Benson, Natalie Walsh, Vivica A. Fox",United States,2017,PG-13,95 min,Comedies,"When cheerleading champs the Rebels are challenged by an edgy new squad, they take on teams from all over the world in a virtual cheer battle."
Movie,Death Note,Adam Wingard,"Willem Dafoe, Nat Wolff, Lakeith Stanfield, Margaret Qualley, Shea Whigham, Paul Nakauchi, Jason Liles",United States,2017,TV-MA,100 min,"Horror Movies, Thrillers","Light Turner finds a supernatural notebook and uses it to mete out death, attracting the attention of a detective, a demon and a girl in his class."
Movie,Hostiles,Scott Cooper,"Christian Bale, Rosamund Pike, Wes Studi, Jesse Plemons, Timothée Chalamet, Ben Foster, Adam Beach, Rory Cochrane, Peter Mullan, Scott Wilson, Paul Anderson, Jonathan Majors, John Benjamin Hickey, Q'orianka Kilcher, Ryan Bingham",United States,2017,R,134 min,Dramas,"After a long career battling the Cheyenne, a U.S. Army captain is ordered to safely escort the tribe's most influential chief to his Montana homeland."
Movie,The Outcasts,Peter Hutchings,"Victoria Justice, Eden Sher, Ashley Rickards, Claudia Lee, Katie Chang, Peyton List, Jazmyn Richardson, Avan Jogia, Will Peltz",United States,2017,PG-13,94 min,Comedies,"After failing to strike a truce with their school's queen bee, two misfit best friends lead a nerd uprising that turns social hierarchy on its head."
Movie,Chocolate City: Vegas Strip,Jean-Claude La Marre,"Robert Ri'chard, Darrin Dewitt Henson, Ginuwine, Gilbert Saldivar, Keith Carlos, Michael Bolwaire, Willie Taylor, Michael Jai White, Vivica A. Fox, Mekhi Phifer",United States,2017,TV-MA,90 min,Dramas,"The exotic dancers from Chocolate City get back together for a trip to Las Vegas and a chance at $500,000 in prize money."
Movie,Naked,Michael Tiddes,"Marlon Wayans, Regina Hall, Dennis Haysbert, Loretta Devine, Eliza Coupe, Scott Foley, J.T. Jackson, Brian McKnight, Cory Hardrict, Neil Brown Jr., David Sheridan, Minka Kelly",United States,2017,TV-14,97 min,"Comedies, Romantic Movies","Rob's madly in love and about to be married. Unfortunately, he's also naked, stuck in an elevator and caught in a time loop."
Movie,The Saint,Ernie Barbarash,"Adam Rayner, Eliza Dushku, Ian Ogilvy, James Remar, Roger Moore, Enrique Murciano, Thomas Kretschmann, Beatrice Rosen, Greg Grunberg, Yani Gellman",United States,2017,TV-14,92 min,Action & Adventure,"Master thief Simon Templar – also known as the Saint – is hired by a wealthy banker to find his kidnapped daughter, but not all is as it seems."
Movie,Louis C.K. 2017,Louis C.K.,Louis C.K.,United States,2017,None Listed,74 min,Movies,"Louis C.K. muses on religion, eternal love, giving dogs drugs, email fights, teachers and more in a live performance from Washington, D.C."
Movie,Rodney King,Spike Lee,Roger Guenveur Smith,United States,2017,TV-MA,53 min,Dramas,Roger Guenveur Smith gives voice to the man at the center of the brutal police beating that helped fuel the 1992 LA riots. Spike Lee directs.
Movie,Kickboxer: Retaliation,Dimitri Logothetis,"Alain Moussi, Jean-Claude Van Damme, Mike Tyson, Christopher Lambert, Sara Malakul Lane, Hafþór Júlíus Björnsson, Sam Medina, Steven Swadling",United States,2017,TV-MA,110 min,Action & Adventure,"Sloan's vow to never return to Thailand is cut short when he's kidnapped and taken to a Thai prison, where he's forced to fight a 400-pound brute."
Movie,Bigger Fatter Liar,Ron Oliver,"Ricky Garcia, Jodelle Ferland, Barry Bostwick, Fiona Vroom, Kevin O'Grady, Karen Holness",United States,2017,PG,95 min,"Children & Family Movies, Comedies","When his video game concept is stolen by a dishonest executive, a teenage chronic liar sets out to prove that he's telling the truth, for once."
Movie,Sandy Wexler,Steven Brill,"Adam Sandler, Jennifer Hudson, Kevin James, Terry Crews, Rob Schneider, Colin Quinn, Nick Swardson, Lamorne Morris, Arsenio Hall, Jamie Gray Hyder",United States,2017,TV-14,131 min,Comedies,"When a hapless but dedicated talent manager signs his first client who actually has talent, his career finally starts to take off."
Movie,Band Aid,Zoe Lister-Jones,"Zoe Lister-Jones, Adam Pally, Fred Armisen, Susie Essman, Retta, Hannah Simone, Brooklyn Decker, Angelique Cabral, Colin Hanks, Ravi V. Patel, Jamie Chung, Erinn Hayes, Gillian Zinser, Jesse Williams",United States,2017,R,94 min,"Comedies, Dramas, Independent Movies","A young married couple tries to save their disintegrating relationship by turning their fights into songs, with the help of an oddball neighbor."
Movie,Frat Star,"Grant S. Johnson, Ippsie Jones","Connor Lawrence, Justin Mark, Cathryn Dylan, Chris Elliott, Tyler Weaks, Max Sheldon, Austin Ramsey, Peter O'Connor, Nicole Balsam, Kaitlin Mesh",United States,2017,TV-MA,85 min,Comedies,A freshman uninterested in joining a fraternity is convinced to pledge by a rich roommate who introduces him to a world darker than he ever dreamed.
Movie,The Trap,Erik White,"T.I., Mike Epps, Loretta Devine, Queen Latifah, Teyana Taylor, Meagan Tandy, Stephen Bishop, Roland Powell, Joel Rush",United States,2017,TV-MA,91 min,Comedies,A man returns home to Atlanta to try and turn around his family's struggling restaurant with the help of a new chicken recipe.
Movie,Carrie Pilby,Susan Johnson,"Bel Powley, Nathan Lane, Vanessa Bayer, Gabriel Byrne, Jason Ritter, Colin O'Donoghue, William Moseley, Desmin Borges",United States,2016,TV-14,98 min,"Comedies, Dramas","A socially awkward 19-year-old genius makes big plans to step out of her shell and make a friend, get a job and – maybe – even go on a date."
Movie,USS Indianapolis: Men of Courage,Mario Van Peebles,"Nicolas Cage, Tom Sizemore, Thomas Jane, Matt Lanter, James Remar, Brian Presley, Johnny Wactor, Adam Scott Miller, Cody Walker, Callard Harris",United States,2016,R,130 min,Action & Adventure,"After becoming stranded in the Philippine Sea during World War II, a tenacious Navy crew faces a dire lack of supplies and a string of shark attacks."
Movie,The Bad Batch,Ana Lily Amirpour,"Suki Waterhouse, Jason Momoa, Keanu Reeves, Jim Carrey, Giovanni Ribisi, Yolonda Ross",United States,2016,R,119 min,"Dramas, Independent Movies, Thrillers","Banished to a wasteland of undesirables, a young woman struggles to find her feet among a drug-soaked desert society and an enclave of cannibals."
Movie,Vincent N Roxxy,Gary Michael Schultz,"Emile Hirsch, Zoë Kravitz, Emory Cohen, Zoey Deutch, Beau Knapp, Jason Mitchell, Scott Mescudi, Jeff Gum, Joey Bicicchi",United States,2016,R,101 min,"Dramas, Thrillers","In rural Louisiana, a terse loner forges a redemptive bond with a woman he saved from a killer, but a violent past soon catches up with both of them."
Movie,I Am Wrath,Chuck Russell,"John Travolta, Christopher Meloni, Amanda Schull, Sam Trammell, Patrick St. Esprit, Rebecca De Mornay, Asante Jones, Paul Sloan, Luis Da Silva Jr., Jordan Whalen",United States,2016,R,91 min,"Action & Adventure, Dramas","Hell-bent on avenging his wife's murder, Stanley Hill summons an old partner's help in exposing a cover-up by crooked cops and slimy politicians."
Movie,Natural Born Pranksters,"Roman Atwood, Ben Pluimer","Roman Atwood, Vitaly Zdorovetskiy, Dennis Roady",United States,2016,R,91 min,Comedies,"The biggest pranksters on YouTube – VitalyzdTV, Dennis Roady and Roman Atwood – turn Hollywood into ""Prankwood"" with their most over-the-top stunts."
Movie,LEGO Jurassic World: The Indominus Escape,Michael D. Black,"A.J. LoCascio, Sendhil Ramamurthy, Fred Tatasciore, Jake Johnson, Lauren Lapkus, Zachary Levi, BD Wong, David Gunning",United States,2016,TV-Y7,25 min,"Children & Family Movies, Comedies",The scientists of Jurassic World create a captivating and terrifying new creature that loves hot dogs. But what happens when the hot dogs run out?
Movie,Strange Weather,Katherine Dieckmann,"Holly Hunter, Carrie Coon, Kim Coates, Shane Jacobsen, Andrene Ward-Hammond, Allene Quincy, Glenne Headly",United States,2016,R,91 min,"Dramas, Independent Movies","A grieving mother takes a road trip with her friend to confront the man who, she believes, stole her late son's business idea to get rich."
Movie,Mascots,Christopher Guest,"Carrie Aizley, Sarah Baker, Bob Balaban, Ed Begley Jr., Tom Bennett, Maria Blasucci, Jennifer Coolidge, Kerry Godliman, Matt Griesser, Christopher Guest, John Michael Higgins, Michael Hitchcock, Don Lake, Jane Lynch, Christopher Moynihan, Chris O'Dowd, Jim Piddock, Parker Posey, Harry Shearer, Fred Willard, Zach Woods, Susan Yeagley",United States,2016,TV-MA,95 min,Comedies,"Eager contestants don big heads and furry suits to vie for the title of World's Best Mascot in this offbeat, comic romp from Christopher Guest."
Movie,Barbie Star Light Adventure,"Andrew Tan, Michael Goguen","Erica Lindbeck, Robbie Daymond, Kimberly Woods, Sarah Anne Williams, Michael Chandler, Dwight Schultz, Ben Bledsoe, Jonathan Lipow, Lucien Dodge, Laura Post",United States,2016,TV-Y,79 min,Children & Family Movies,"A hoverboard-riding princess of the cosmos, Barbie must band together with a team of talented new friends to save the stars from winking out."
Movie,Monster High: Great Scarrier Reef,William Lau,"Larissa Galagher, Kate Higgins, Debi Derryberry, Salli Saffioti, America Young, Evan Smith, Lyndsy Kail, Rachel Staman, Cherami Leigh, Paula Rhodes, Erin Fitzgerald",United States,2016,TV-Y7,72 min,Children & Family Movies,"At a Monster High party, Lagoona and pals are sucked into the reef, where she'll have to come to terms with her flaws and confront an old frenemy."
Movie,Welcome to Monster High: The Origin Story,"Stephen Donnelly, Olly Reid, Jun Falkenstein","Debi Derryberry, Cassandra Morris, Salli Saffioti, Larissa Gallagher, Cristina Milizia, Michael Sorich, Jonquil Goode, Travis Dresden, Evan Smith",United States,2016,TV-Y7,73 min,Children & Family Movies,Dracula's daughter Draculaura sets out to create a new kind of school where monsters of all kinds can be themselves and have a scary good time.
Movie,The Journey Is the Destination,Bronwen Hughes,"Ben Schnetzer, Kelly Macdonald, Sam Hazeldine, Ella Purnell, Maria Bello, Yusra Warsama",United States,2016,R,123 min,Dramas,Spirited 22-year-old activist and photojournalist Dan Eldon rushes to the frontline of a dangerous relief effort for Somalian refugees in this biopic.
Movie,Mercy,Chris Sparling,"James Wolk, Caitlin Fitzgerald, Tom Lipinski, Dan Ziskie, Michael Godere, Michael Donovan, Dion Graham, Constance Barron",United States,2016,TV-MA,88 min,"Dramas, Thrillers",Two brothers clash with their half-siblings when a visit home to see their dying mother surfaces old secrets and becomes a fight for survival.
Movie,LEGENDS OF THE HIDDEN TEMPLE,Joe Menendez,"Isabela Moner, Jet Jurgensmeyer, Colin Critchley, Kirk Fogg, Dee Bradley Baker",United States,2016,TV-PG,68 min,Children & Family Movies,"A trio of siblings gets trapped in a secret temple, where they must navigate a risky obstacle course to make it out. Inspired by the ‘90s game show."
Movie,Shopkins: Chef Club,Raymond McGrath,"Erika Harlacher, Marieve Herington, David Lodge, Cassandra Morris, Kate Murphy, Abby Trott",United States,2016,TV-Y,45 min,Movies,"In this first full Shopkins movie, Peppa-Mint is the new Shoppie in town who stirs things up by hosting a team cooking competition."
Movie,True Memoirs of an International Assassin,Jeff Wadlow,"Kevin James, Andy Garcia, Zulay Henao, Maurice Compte, Kelen Coleman, Andrew Howard, Rob Riggle, Leonard Earl Howze, Yul Vazquez, Kim Coates, Daniel Zacapa, Ron Rifkin, Jeff Chase",United States,2016,TV-14,98 min,"Action & Adventure, Comedies","After his publisher markets his crime novel as a memoir, a novice author finds himself forcibly recruited into a deadly political plot in Venezuela."
Movie,The Do-Over,Steven Brill,"Adam Sandler, David Spade, Paula Patton, Kathryn Hahn, Nick Swardson, Catherine Bell, Michael Chiklis, Natasha Leggero, Sean Astin",United States,2016,TV-MA,109 min,"Action & Adventure, Comedies",The life of a bank manager is turned upside down when a friend from his past manipulates him into faking his own death and taking off on an adventure.
Movie,Moonlight,Barry Jenkins,"Trevante Rhodes, André Holland, Janelle Monáe, Ashton Sanders, Jharrel Jerome, Alex Hibbert, Jaden Piner, Naomie Harris, Mahershala Ali",United States,2016,R,111 min,"Dramas, Independent Movies, LGBTQ Movies","In a crime-infested Miami neighborhood, a gay African-American boy with a drug-addicted mother grows up with the help of a mentoring drug dealer."
Movie,Lovesong,So Yong Kim,"Jena Malone, Riley Keough, Brooklyn Decker, Amy Seimetz, Ryan Eggold, Rosanna Arquette, Cary Joji Fukunaga, Marshall Chapman, Neal Huff",United States,2016,TV-MA,84 min,"Dramas, Independent Movies, Romantic Movies","Best friends Sarah and Mindy share an unexpected moment while on a road trip. Years later, the two struggle to reconnect before a wedding."
Movie,Jewel's Catch One,C. Fitz,Jewel Thais-Williams,United States,2016,NR,84 min,"Documentaries, LGBTQ Movies","The story of famed L.A. nightclub Catch One and owner Jewel Thais-Williams, who defied all odds and provided a safe space for black LGBT communities."
Movie,A Kind of Murder,Andy Goddard,"Patrick Wilson, Jessica Biel, Vincent Kartheiser, Haley Bennett, Eddie Marsan, Jon Osbeck, Radek Lord, Christine Dye",United States,2016,R,96 min,Thrillers,"Obsessed with an unsolved murder case, a crime novelist stuck in an unhappy marriage fantasizes about killing his wife, who soon turns up dead."
Movie,Don't Think Twice,Mike Birbiglia,"Keegan-Michael Key, Gillian Jacobs, Mike Birbiglia, Kate Micucci, Chris Gethard, Richard Masur, Tami Sagher, Erin Darke",United States,2016,R,92 min,"Comedies, Dramas, Independent Movies",Six talented but struggling improv comics see a sudden shift in their troupe's dynamic after one of them lands a much-coveted gig on television.
Movie,Officer Downe,Shawn Crahan,"Kim Coates, Tyler Ross, Lauren Vélez, Reno Wilson, Bruno Gunn, Tracy Vilar, Sona Eyambe, Corey Taylor, Meadow Williams",United States,2016,R,91 min,Action & Adventure,Fallen Los Angeles police officer Terrence Downe finds new life as a secret weapon: a scientifically altered super-cop with unlimited lives.
Movie,The Bleeder,Philippe Falardeau,"Liev Schreiber, Elisabeth Moss, Ron Perlman, Naomi Watts, Jim Gaffigan, Michael Rapaport, Pooch Hall, Morgan Spector, Jason Jones",United States,2016,R,98 min,"Dramas, Sports Movies","Husband. Father. Fighter. Meet Chuck Wepner, the liquor salesman and self-proclaimed real-life inspiration behind Rocky Balboa."
Movie,Kung Fu Panda: Secrets of the Scroll,Rodolphe Guenoden,"Jack Black, Dustin Hoffman, Seth Rogen, David Cross, Lucy Liu, Tara Macri, James Hong, Randall Duk Kim",United States,2016,TV-PG,23 min,"Children & Family Movies, Comedies","When a twist of fate brings five unlikely animals together, they find that combining their unique kung fu styles as a team makes the perfect weapon!"
Movie,Wakefield,Robin Swicord,"Bryan Cranston, Jennifer Garner, Jason O'Mara, Beverly D'Angelo, Ian Anthony Dale, Pippa Bennett-Warner, Isaac Leyva, Victoria Bruno, Ellery Sprayberry, Tracey Walter",United States,2016,R,109 min,Dramas,"An unhappy father and lawyer quits his suburban life and vanishes into the attic above his garage, where he watches his family move on without him."
Movie,The Hollow Point,Gonzalo López-Gallego,"Patrick Wilson, Ian McShane, John Leguizamo, Lynn Collins, Jim Belushi, Karli Hall, David H. Stevens, Derek Boone",United States,2016,R,97 min,Action & Adventure,New straight-arrow sheriff Wallace finds he must join forces with brutal ex-lawman Leland to protect a troubled border town from a cartel hit man.
Movie,Mango Dreams,John Upchurch,"Ram Gopal Bajaj, Pankaj Tripathi, Sameer Kochhar",United States,2016,TV-14,92 min,"Dramas, Independent Movies","Concerned that dementia will soon steal his most cherished memories, a Hindu doctor hires a Mulsim rickshaw driver to take him to his childhood home."
Movie,Namour,Heidi Saman,"Karim Saleh, Waleed Zuaiter, Nicole Haddad, Mona Hala, Wedad Abdel Aziz Abdou, Lavrenti Lopes, Jessica Lu, Amin El Gamal, Melina Lizette, Tom Lenk, Terry Walters",United States,2016,NR,80 min,"Dramas, Independent Movies","Aimless valet driver Steven Bassem can't find the motivation to get a better job, even when his fractious immigrant family starts falling apart."
Movie,The Christmas Project,Michael Buster,"Jacob Buster, Anson Bagley, Grace Hallows, Josh Reid, Cooper Daniel Johnson, Alison Akin Clark, Brian Neal Clark, Evan Clark, Caitlin E.J. Meyer, Gabe White",United States,2016,TV-PG,92 min,"Children & Family Movies, Comedies",Four brothers prepare for war when they're forced to deliver secret holiday gifts to the school bullies. But they soon learn kindness goes a long way.
Movie,Love Beats Rhymes,RZA,"Azealia Banks, Lucien Laviscount, Jill Scott, Common, Lorraine Toussaint, Hana Mae Lee, Jeremie Harris",United States,2016,R,106 min,"Dramas, Romantic Movies","After enrolling in a college poetry course, a struggling rapper finds inspiration for her new voice through slam poetry."
Movie,Blue Mountain State: The Rise of Thadland,Lev L. Spiro,"Alan Ritchson, Darin Brooks, James Cade, Rob Ramsay, Chris Romano, Frankie Shaw, Omari Newton, Ed Marinaro, Dhani Jones, Ed Amatrudo, Jimmy Tatro",United States,2016,R,90 min,Comedies,"New NFL star Thad buys his old teammates' beloved frat house, renames it Thadland and throws the raunchiest, most debauched party in school history."
Movie,Hot Bot,Michael Polish,"Cynthia Kirchner, Doug Haley, Zack Pearlman, Larry Miller, Danny Masterson, Anthony Anderson, David Shackelford, Donald Faison, Angela Kinsey, Kirby Bliss Blanton, John Robinson",United States,2016,NR,93 min,Comedies,"Two teenage geeks inadvertently find a lifelike, state-of-the-art sex robot, but must dodge the high-profile owner who lost her in order to keep her."
