type,title,director,cast,country,release_year,content_rating,duration,genre,description
TV Show,Go! Go! Cory Carson,None Listed,"Alan C. Lim, Paul Killam, Maisie Benson, Kerry Gudjohnsen, Smith Foreman, Neena-Sinaii Simpo, Eli Morse, Adelaide Hirasaki, Jim Capobianco, Anna Chambers, Pfifer Chastain",United States,2020,TV-Y,1 Season,Kids' TV,"Beep, beep – go, go! Buckle up for fun and adventure with adorable kid car Cory Carson as he explores the winding roads of Bumperton Hills."
TV Show,Kipo and the Age of Wonderbeasts,None Listed,"Karen Fukuhara, Sydney Mikayla, Deon Cole, Coy Stewart, Dee Bradley Baker, Sterling K. Brown, Dan Stevens, Jake Green, Steve Blum",United States,2020,TV-Y7-FV,1 Season,"Kids' TV, TV Comedies","Making her way through a world of mutant animals, a sheltered yet scrappy girl learns how to survive – and get home – with help from her ragtag crew."
TV Show,AJ and the Queen,None Listed,"RuPaul Charles, Izzy G., Michael-Leon Wooley, Josh Segarra, Katerina Tannenbaum, Tia Carrere",United States,2020,TV-14,1 Season,"TV Comedies, TV Dramas","While traveling across the country in a run-down RV, drag queen Ruby Red discovers an unlikely sidekick in AJ: a tough-talking 10-year-old stowaway."
TV Show,BONDING,None Listed,"Zoe Levin, Brendan Scannell, Micah Stock, Theo Stockman, Alex Hurt, D'Arcy Carden, Gabrielle Ryan, Charles Gould",United States,2019,TV-MA,1 Season,"TV Comedies, TV Dramas",A New York City grad student moonlighting as a dominatrix enlists her gay BFF from high school to be her assistant.
TV Show,The Last Kids on Earth,None Listed,"Nick Wolfhard, Charles Demers, Garland Whitt, Montse Hernandez, Brian Drummond, Giles Panton, Keith David",United States,2019,TV-Y7-FV,1 Season,"Kids' TV, TV Comedies","When zombies and monsters invade his hometown, a scrappy 13-year-old orphan teams up with his friends in hopes of surviving the chaos."
TV Show,Unbelievable,None Listed,"Toni Collette, Merritt Wever, Kaitlyn Dever, Dale Dickey, Scott Lawrence, Danielle Macdonald, Austin Hébert, Eric Lange, Elizabeth Marvel",United States,2019,TV-MA,1 Season,"Crime TV Shows, TV Dramas","After a young woman is accused of lying about a rape, two female detectives investigate a spate of eerily similar attacks. Inspired by true events."
TV Show,Transformers Rescue Bots Academy,None Listed,"Adam Andrianopolous, Pierce Cravens, Xander Crowell, Paul Guyet, Michael Hansen, Mason Hensley, Courtney Shaw, Alan Trinca, Keyon Williams, Andy Zou",United States,2019,TV-Y,1 Season,Kids' TV,"As part of the first class at the Rescue Bots Academy, five Cybertron recruits train under their skilled teachers and take on daring rescue missions."
TV Show,Rhythm + Flow,None Listed,"Cardi B, Chance The Rapper, T.I.",United States,2019,TV-MA,1 Season,Reality TV,"In this music competition show, judges Tip “T.I.” Harris, Cardi B and Chance the Rapper hit the streets to find the next rap superstar."
TV Show,Living with Yourself,None Listed,"Paul Rudd, Aisling Bea, Desmin Borges, Zoë Chao, Karen Pittman",United States,2019,TV-MA,1 Season,"TV Comedies, TV Dramas","Burned out on life, Miles undergoes a strange procedure at a strip mall spa – and wakes to find he's been replaced by a better version of himself."
TV Show,Power Rangers Beast Morphers,None Listed,"Rorrie D. Travis, Jazz Baduwalia, Jacqueline Scislowski, Abraham Rodríguez, Teuila Blakely, Kristina Ho, Cosme Flores, Kevin Copeland",United States,2019,TV-Y7-FV,1 Season,Kids' TV,A new breed of secret agents must stop a ruthless computer virus and its minions from stealing the unlimited clean energy source that created them.
TV Show,Sugar Rush Christmas,None Listed,"Hunter March, Candace Nelson, Adriano Zumbo",United States,2019,TV-PG,1 Season,Reality TV,"It's everything you love about ""Sugar Rush"" – with a holly jolly holiday twist – in this Christmas-themed spin on competitive baking."
TV Show,Merry Happy Whatever,None Listed,"Dennis Quaid, Bridgit Mendler, Brent Morin, Ashley Tisdale, Siobhan Murphy, Adam Rose, Elizabeth Ho, Hayes MacArthur, Garcelle Beauvais, Tyler Ritter, Mason Davis, Lucas Jaye",United States,2019,TV-PG,1 Season,TV Comedies,"A struggling LA musician tries to win over his new girlfriend's gruff dad and quirky, tight-knit siblings on a 10-day Christmas visit to Philadelphia."
TV Show,Dolly Parton's Heartstrings,None Listed,"Dolly Parton, Julianne Hough, Kimberly Williams-Paisley, Dallas Roberts, Melissa Leo, Andy Mientus, Katie Stevens, Michael J. Willett, Aidan Langford, Ray McKinnon, Delta Burke, Gerald McRaney, Ben Lawson, Brooke Elliott, Michele Weaver, Tim Reid, Sarah Shahi, Rochelle Aytes, Jessica Collins, Tammy Lynn Michaels, Robert Taylor, Holly Taylor, Shane Paul McGhie, Mary Lane Haskell, Camryn Manheim, Bellamy Young, Patricia Wettig, Timothy Busfield, Tom Brittney, Virginia Gardner, Colin O'Donoghue, Willa Fitzgerald, David Denman, Vanessa Rubio, Mac Davis, Kathleen Turner, Ginnifer Goodwin, Kyle Bornheimer, Tyler Crumley, Mary Donnelly Haskell, Ed Amatrudo",United States,2019,TV-14,1 Season,TV Dramas,"Eight stories celebrating family, faith, love and forgiveness come to life in this series inspired by Dolly Parton's iconic country music catalog."
TV Show,I'm with the Band: Nasty Cherry,None Listed,"Charli XCX, Emmie Lichtenberg, Gabbriette Bechtel, Chloe Chaidez, Deborah Knox- Hewson, Georgia Somary",United States,2019,TV-MA,1 Season,Reality TV,"In an unfiltered, intimate docuseries, pop star mentor Charli XCX finds out what it takes to build – and break – a real, badass all-girl punk band."
TV Show,When They See Us,None Listed,"Asante Blackk, Caleel Harris, Ethan Herisse, Jharrel Jerome, Marquis Rodriguez, Jovan Adepo, Chris Chalk, Justin Cunningham, Freddy Miyares, Michael Kenneth Williams, Marsha Stephanie Blake, Kylie Bunbury, Aunjanue Ellis, Vera Farmiga, Felicity Huffman, John Leguizamo, Niecy Nash",United States,2019,TV-MA,1 Season,"Crime TV Shows, TV Dramas",Five teens from Harlem become trapped in a nightmare when they're falsely accused of a brutal attack in Central Park. Based on the true story.
TV Show,Dead to Me,None Listed,"Christina Applegate, Linda Cardellini, James Marsden, Max Jenkins, Sam McCarthy, Luke Roessler, Edward Asner",United States,2019,TV-MA,1 Season,"TV Comedies, TV Dramas",A hotheaded widow searching for the hit-and-run driver who mowed down her husband befriends an eccentric optimist who isn't quite what she seems.
TV Show,Tuca & Bertie,None Listed,"Tiffany Haddish, Ali Wong, Steven Yeun, Nicole Byer, Richard E. Grant, Reggie Watts",United States,2019,TV-MA,1 Season,TV Comedies,Free-spirited toucan Tuca and self-doubting song thrush Bertie are best friends – and birds – who guide each other through life's ups and downs.
TV Show,Historical Roasts,None Listed,"Jeff Ross, Bob Saget, James Adomian, Rachel Feinstein, Jerry Minor, Ayden Mayeri, Jaleel White, Natasha Leggero, Yamaneika Saunders, John Stamos, Nikki Glaser, Seth Green, Fortune Feimster, Jon Lovitz, Mindy Rickles, Gilbert Gottfried, Sasheer Zamata, Brandon T. Jackson, Ryan Phillippe, Ken Marino, Bridget Everett, John Gemberling, Leonardo Nam, Josh Homme",United States,2019,TV-MA,1 Season,"Stand-Up Comedy & Talk Shows, TV Comedies","""Roastmaster General"" Jeff Ross and a slew of guest stars poke fun at major historical figures while also honoring their enduring impact on the world."
TV Show,It's Bruno!,None Listed,"Solvan ""Slick"" Naim, Rob Morgan, Shakira Barrera, Jade Eshete, Adriane Lenox, Donnell Rawlings, Eden Marryshow, Sam Eliad, Devale Ellis, J. Ray Acosta",United States,2019,TV-MA,1 Season,TV Comedies,"An old-school Brooklyn native devotes his days to caring for his adorable dog, Bruno – and making sure the neighbors show his pooch the proper respect."
TV Show,Charlie's Colorforms City,None Listed,"Jacob Soley, Saara Chaudry, Tyler Barish, Zoe Hatz, Julie Lemieux, Joseph Motiki, Shoshana Sperling, Adrianna Di Liello, Deann Degruijter, Stacey DePass",United States,2019,TV-Y,1 Season,Kids' TV,"Charlie creates fun stories using different shapes, and he needs your help! Take off for adventures in outer space, the Wild West – and right at home."
TV Show,Super Monsters Monster Pets,None Listed,"Erin Mathews, Kathleen Barr, Chiara Zanni, Rebecca Shoichet, Sabrina Pitre, Ingrid Nilson, Alessandro Juliani, Elyse Maloway, Vincent Tong",United States,2019,TV-Y,1 Season,Kids' TV,The adorably magical Monster Pets star in a series of short adventures that are big on fun – and full of surprises!
TV Show,Tales of the City,None Listed,"Laura Linney, Ellen Page, Olympia Dukakis, Paul Gross, Murray Bartlett, Barbara Garrick, Charlie Barnett, Garcia, May Hong, Jen Richards, Victor Garber, Ashley Park, Christopher Larkin, Zosia Mamet, Molly Ringwald, Daniela Vega",United States,2019,TV-MA,1 Season,TV Dramas,"Returning to San Francisco after a long absence, Mary Ann Singleton reunites with the community of characters at 28 Barbary Lane."
TV Show,Mr. Iglesias,None Listed,"Gabriel Iglesias, Sherri Shepherd, Jacob Vargas, Maggie Geha, Richard Gant, Cree Cicchino, Fabrizio Guido, Oscar Nuñez",United States,2019,TV-14,1 Season,TV Comedies,Hilarious high school teacher Gabriel Iglesias tries to make a difference in the lives of some smart but underperforming students at his alma mater.
TV Show,Awake: The Million Dollar Game,None Listed,James Davis,United States,2019,TV-PG,1 Season,Reality TV,"Sleepless for 24 hours, contestants in the comedy game show stumble through challenges both eccentric and everyday for a chance at a $1 million prize."
TV Show,In The Dark,None Listed,"Perry Mattfeld, Brooke Markham, Casey Deidrick, Keston John, Morgan Krantz, Rich Sommer, Thamela Mpumlwana, Saycon Sengbloh, Kathleen York, Derek Webster",United States,2019,TV-14,1 Season,"Crime TV Shows, TV Dramas",A blind woman with vices finds herself in the middle of a murder investigation when her best friend turns up dead.
TV Show,Twelve Forever,None Listed,"Kelsy Abbott, Antony Del Rio, Jaylen Barron, Matt Berry, Bridget Everett, Brandon Wardell, Steve Agee, Spencer Rothbell, Nick Sumida, Ashley Boettcher, Wade Randolph",United States,2019,TV-Y7,1 Season,Kids' TV,Reggie's wild imagination unlocks a weird and wonderful world where she can be herself – and escape the pressures of growing up.
TV Show,Family Reunion,None Listed,"Loretta Devine, Tia Mowry-Hardrict, Anthony Alabi, Talia Jackson, Isaiah Russell-Bailey, Cameron J. Wright, Jordyn Raya James, Richard Roundtree",United States,2019,TV-PG,1 Season,TV Comedies,"When the McKellan family moves from Seattle to small-town Georgia, life down South – and traditional grandparents – challenge their big-city ways."
TV Show,Tidying Up with Marie Kondo,None Listed,Marie Kondo,United States,2019,TV-PG,1 Season,Reality TV,"In a series of inspiring home makeovers, world-renowned tidying expert Marie Kondo helps clients clear out the clutter – and choose joy."
TV Show,Russian Doll,None Listed,"Natasha Lyonne, Charlie Barnett, Yul Vazquez, Elizabeth Ashley, Dascha Polanco, Jeremy Bobb, Greta Lee, Rebecca Henderson, Brendan Sexton III, Chloë Sevigny, Brooke Timber",United States,2019,TV-MA,1 Season,"TV Comedies, TV Dramas",Nadia keeps dying and reliving her 36th birthday party. She's trapped in a surreal time loop – and staring down the barrel of her own mortality.
TV Show,Astronomy Club: The Sketch Show,None Listed,"Shawtane Bowen, Jonathan Braylock, Ray Cordova, Caroline Martin, Jerah Milligan, Monique Moses, Keisha Zollar, James III",United States,2019,TV-MA,1 Season,TV Comedies,"With unique individual perspectives that converge into a unified voice, sketch comedy group Astronomy Club delivers a smart and absurd brand of humor."
TV Show,Fast & Furious Spy Racers,None Listed,"Tyler Posey, Charlet Chung, Jorge Diaz, Camille Ramsey, Luke Youngblood, Renée Elise Goldsberry",United States,2019,TV-Y7-FV,1 Season,Kids' TV,A government agency recruits teen driver Tony Toretto and his thrill-seeking friends to infiltrate a criminal street racing circuit as undercover spies.
TV Show,Tiny House Nation,None Listed,None Listed,United States,2019,TV-PG,1 Season,Reality TV,"Traveling the U.S., host John Weisbarth and expert Zack Giffin are helping families prep for the tiny lifestyle and create hypercustomized mini homes."
TV Show,Hyperdrive,None Listed,"Rutledge Wood, Mike Hill, Michael Bisping, Lindsay Czarniak",United States,2019,TV-PG,1 Season,Reality TV,"Elite street racers from around the world test their limits in supercharged custom cars on the biggest, baddest automotive obstacle course ever built."
TV Show,Tiffany Haddish Presents: They Ready,None Listed,"Tracey Ashley, Flame Monroe, Aida Rodriguez, Marlo Williams, April Macie, Chaunté Wayans, Tiffany Haddish",United States,2019,TV-MA,1 Season,"Stand-Up Comedy & Talk Shows, TV Comedies","Hand-picked by Tiffany Haddish, six diverse comedians showcase their raw humor in a series of specials oozing with energy."
TV Show,DC Super Hero Girls,None Listed,"Grey Griffin, Tara Strong, Nicole Sullivan, Kari Wahlgren, Myrna Velasco, Kimberly Brooks",United States,2019,TV-Y7-FV,1 Season,Kids' TV,"As Metropolis High students, super teens Wonder Woman, Supergirl, Bumblebee, Batgirl, Zatanna, and Green Lantern fight crime, classwork and crushes."
TV Show,I Think You Should Leave with Tim Robinson,None Listed,"Tim Robinson, Andy Samberg, Sam Richardson, Will Forte, Fred Willard, Cecily Strong, Tim Heidecker, Kate Berlant",United States,2019,TV-MA,1 Season,TV Comedies,There is no such thing as an ordinary interaction in this offbeat sketch comedy series that features a deep roster of guest stars.
TV Show,Huge in France,None Listed,"Gad Elmaleh, Scott Keiji Takeda, Jordan Ver Hoeve, Erinn Hayes, Matthew Del Negro",United States,2019,TV-MA,1 Season,TV Comedies,"Eager to reconnect with his son, French comedy star Gad Elmaleh moves to LA, only to discover that he's left all his fame and celebrity perks behind."
TV Show,Special,None Listed,"Ryan O'Connell, Jessica Hecht, Punam Patel, Marla Mindelle, Augustus Prew, Patrick Fabian",United States,2019,TV-MA,1 Season,TV Comedies,A young gay man with cerebral palsy branches out from his insular existence in hopes of finally going after the life he wants.
TV Show,Fastest Car,None Listed,None Listed,United States,2019,TV-MA,2 Seasons,Reality TV,The drivers of exotic supercars put their street cred on the line against deceptively fast sleeper cars built and modified by true gearheads.
TV Show,I'm Sorry,None Listed,"Andrea Savage, Tom Everett Scott, Olive Petrucci",United States,2019,TV-MA,2 Seasons,TV Comedies,"Life is a series of awkward situations for comedy writer and mom Andrea, thanks to plenty of neuroses and a knack for sticking her foot in her mouth."
TV Show,The Ranch,None Listed,"Ashton Kutcher, Sam Elliott, Debra Winger, Elisha Cuthbert, Kelli Goss, Wilmer Valderrama, Danny Masterson",United States,2019,TV-MA,7 Seasons,TV Comedies,"Being a pro athlete didn't pan out for Colt. Now he's helping his dad and brother keep the ranch afloat, and figuring out how he fits into the family."
TV Show,Jeopardy!,None Listed,Alex Trebek,United States,2019,TV-G,5 Seasons,Reality TV,"Alex Trebek hosts one of TV's longest-running game shows, where a trio of players buzz in with their knowledge of history, arts, pop culture and more."
TV Show,BoJack Horseman,None Listed,"Will Arnett, Aaron Paul, Amy Sedaris, Alison Brie, Paul F. Tompkins",United States,2019,TV-MA,6 Seasons,TV Comedies,"Meet the most beloved sitcom horse of the '90s, 20 years later. He’s a curmudgeon with a heart of...not quite gold...but something like gold. Copper?"
TV Show,The Kominsky Method,None Listed,"Michael Douglas, Alan Arkin, Sarah Baker, Nancy Travis, Susan Sullivan, Lisa Edelstein, Emily Osment, Graham Rogers, Jenna Lyng Adams, Ashleigh LaThrop, Melissa Tang, Casey Thomas Brown, Ann-Margret, Danny DeVito",United States,2019,TV-MA,2 Seasons,"TV Comedies, TV Dramas",Acting coach Sandy Kominsky and best friend Norman Newlander keep each other laughing as they navigate the ups and downs of getting older.
TV Show,Spirit Riding Free: Pony Tales,None Listed,"Amber Frank, Bailey Gambertoglio, Sydney Park, Darcy Rose Byrnes, Gabriella Graves, Duncan Joiner, Nolan North",United States,2019,TV-Y,2 Seasons,Kids' TV,"Find the fun and adventure of ""Spirit Riding Free"" in this mix of music videos and short episodes featuring Lucky and all of her friends!"
TV Show,Nailed It! Holiday!,None Listed,"Nicole Byer, Jacques Torres",United States,2019,TV-PG,2 Seasons,Reality TV,"It's the ""Nailed It!"" holiday special you've been waiting for, with missing ingredients, impossible asks and desserts that look delightfully sad."
TV Show,Trolls: The Beat Goes On!,None Listed,"Amanda Leighton, Skylar Astin, Ron Funches, David Fynn, David Koechner, David Kaye, Sean T. Krishnan, Sam Lerner, Patrick Pinney, Kevin Michael Richardson, Kari Wahlgren, Fryda Wolff",United States,2019,TV-G,8 Seasons,"Kids' TV, TV Comedies","As Queen Poppy welcomes a new time of peace in Troll Village with parties, sports and holiday celebrations, Branch tries to be more fun-loving."
TV Show,Llama Llama,None Listed,"Jennifer Garner, Shayle Simons, Vania Gill, Islie Hirvonen, Brendon Sunderland, Austin Abell, Evans Johnson, Kathleen Barr, David Hoole",United States,2019,TV-Y,2 Seasons,Kids' TV,"Beloved children's book character Llama Llama springs to life in this heartwarming series about family, friendship and learning new things."
TV Show,The Boulet Brothers Dragula,None Listed,Boulet Brothers,United States,2019,TV-MA,2 Seasons,Reality TV,"Ten queens must slay the competition and put their fiercest, filthiest faces forward for the chance to be crowned the world's next drag supermonster."
TV Show,Unbreakable Kimmy Schmidt,None Listed,"Ellie Kemper, Jane Krakowski, Tituss Burgess, Carol Kane",United States,2019,TV-14,4 Seasons,TV Comedies,"When a woman is rescued from a doomsday cult and lands in New York City, she must navigate a world she didn’t think even existed anymore."
TV Show,Arrested Development,None Listed,"Jason Bateman, Portia de Rossi, Will Arnett, Michael Cera, Alia Shawkat, Tony Hale, David Cross, Jeffrey Tambor, Jessica Walter, Ron Howard",United States,2019,TV-14,5 Seasons,TV Comedies,"It's the Emmy-winning story of a wealthy family that lost everything, and the one son who had no choice but to keep them all together."
TV Show,Riverdale,Rob Seidenglanz,"K.J. Apa, Lili Reinhart, Camila Mendes, Cole Sprouse, Marisol Nichols, Madelaine Petsch, Ashleigh Murray, Mädchen Amick, Luke Perry, Casey Cott, Charles Melton, Mark Consuelos, Lochlyn Munro, Peter Bryant, Colin Lawrence, Molly Ringwald, Asha Bromfield, Barclay Hope, Hayley Law, Martin Cummins, Sarah Habel, Nathalie Boltt, Skeet Ulrich",United States,2019,TV-14,3 Seasons,"Crime TV Shows, TV Dramas, TV Mysteries","While navigating the troubled waters of sex, romance, school and family, teen Archie and his gang become entangled in a dark Riverdale mystery."
TV Show,Prince of Peoria,None Listed,"Gavin Lewis, Theodore Barnes, Shelby Simmons, Cynthia Kaye McWilliams",United States,2019,TV-Y7,2 Seasons,"Kids' TV, TV Comedies",A prankster prince who wants to experience life as an ordinary teen leaves his kingdom to live incognito with a single mom and her studious son.
TV Show,Nailed It,None Listed,"Nicole Byer, Jacques Torres",United States,2019,TV-PG,3 Seasons,Reality TV,"Home bakers with a terrible track record take a crack at re-creating edible masterpieces for a $10,000 prize. It's part reality contest, part hot mess."
TV Show,Easy,None Listed,"Aubrey Plaza, Judy Greer, Jane Adams, Zazie Beetz, Kate Berlant, Aya Cash, Michael Chernus, Kiersey Clemons, Orlando Bloom, Malin Akerman, Marc Maron, Dave Franco, Hannibal Buress, Jake Johnson, Emily Ratajkowski, Andrew Bachelor",United States,2019,TV-MA,3 Seasons,"TV Comedies, TV Dramas","This eclectic, star-studded anthology follows diverse Chicagoans fumbling through the modern maze of love, sex, technology and culture."
TV Show,Madam Secretary,None Listed,"Téa Leoni, Tim Daly, Bebe Neuwirth, Zeljko Ivanek, Erich Bergen, Patina Miller, Geoffrey Arend, Kathrine Herzer, Evan Roe, Wallis Currie-Wood",United States,2019,TV-14,5 Seasons,TV Dramas,"When a highly capable woman becomes secretary of state, she struggles to find balance between the demands of world politics and those of her family."
TV Show,Documentary Now!,None Listed,"Fred Armisen, Bill Hader, Helen Mirren",United States,2019,TV-14,3 Seasons,TV Comedies,"Elevating the art of parody, this sharply comic series spoofs high-profile documentaries such as ""Grey Gardens"" and ""The Thin Blue Line."""
TV Show,Dynasty,None Listed,"Elizabeth Gillies, Nathalie Kelley, Grant Show, James Mackay, Rafael De La Fuente, Alan Dale, Sam Adegoke, Robert Christopher Riley",United States,2019,TV-14,2 Seasons,TV Dramas,The Carringtons and the Colbys feud for control over their fortune – and their children – in this updated reboot of the classic prime-time soap.
TV Show,Girlfriends' Guide to Divorce,None Listed,"Lisa Edelstein, Beau Garrett, Necar Zadegan, Paul Adelstein, Janeane Garofalo, Alanna Ubach",United States,2019,TV-14,5 Seasons,"TV Comedies, TV Dramas","After the world learns the truth about her failing marriage, a successful self-help author tries to salvage her career and find her way as a divorcée."
TV Show,Orange Is the New Black,None Listed,"Taylor Schilling, Kate Mulgrew, Laura Prepon, Jason Biggs, Natasha Lyonne, Michael Harney, Uzo Aduba, Danielle Brooks, Samira Wiley, Dascha Polanco, Selenis Leyva, Nick Sandow, Yael Stone, Taryn Manning, Lea DeLaria, Matt McGorry, Emma Myles, Vicky Jeudy, Laverne Cox, Pablo Schreiber, Lori Petty, Ruby Rose, Adrienne C. Moore, Jackie Cruz, Elizabeth Rodriguez",United States,2019,TV-MA,7 Seasons,"TV Comedies, TV Dramas","A privileged New Yorker ends up in a women's prison when a past crime catches up with her in this Emmy-winning series from the creator of ""Weeds."""
TV Show,Sugar Rush,None Listed,"Candace Nelson, Adriano Zumbo, Hunter March",United States,2019,TV-PG,2 Seasons,Reality TV,Time's the most important ingredient as teams race against the clock – and each other – to bake up the best-tasting sweets.
TV Show,Comedians in Cars Getting Coffee,Jerry Seinfeld,Jerry Seinfeld,United States,2019,TV-14,6 Seasons,"Stand-Up Comedy & Talk Shows, TV Comedies","Jerry Seinfeld's roving talk show combines coffee, laughs and vintage cars into quirky, caffeine-fueled adventures with the sharpest minds in comedy."
TV Show,Queer Eye,None Listed,"Bobby Berk, Karamo Brown, Tan France, Antoni Porowski, Jonathan Van Ness",United States,2019,TV-14,4 Seasons,Reality TV,"An all-new “Fab Five” advise men on fashion, grooming, food, culture and design in this modern reboot of the Emmy Award-winning reality series."
TV Show,The Epic Tales of Captain Underpants,None Listed,"Nat Faxon, Jay Gragnani, Ramone Hamilton, Sean Astin, Dayci Brookshire, Jorge Diaz, Evan Kishiyama",United States,2019,TV-Y7,3 Seasons,"Kids' TV, TV Comedies",Fourth-grade friends George and Harold have a shared love of pranks and comic books – and turning their principal into an undies-wearing superhero.
TV Show,Pinky Malinky,None Listed,"Lucas Grabeel, Nathan Kress, Diamond White, Danny Jacobs, Retta, Colleen Smith, Vargus Mason, Lauren Tom, Robbie Daymond, Grey Griffin",United States,2019,TV-Y7,3 Seasons,"Kids' TV, TV Comedies","Pinky Malinky sees the bright side of everything, including being born a hot dog. With his BFFs in tow, this little wiener takes a bite out of life."
TV Show,Grace and Frankie,None Listed,"Jane Fonda, Lily Tomlin, Martin Sheen, Sam Waterston, June Diane Raphael, Brooklyn Decker, Ethan Embry, Baron Vaughn",United States,2019,TV-MA,5 Seasons,"TV Comedies, TV Dramas","They’re not friends, but when their husbands leave them for each other, proper Grace and eccentric Frankie begin to bond in this Emmy-nominated series."
TV Show,Harvey Street Kids,None Listed,"Lauren Lapkus, Stephanie Lemelin, Kelly McCreary, Atticus Shaffer, Danny Pudi, Grey Griffin, Utkarsh Ambudkar, Roger Craig Smith",United States,2019,TV-Y7,3 Seasons,"Kids' TV, TV Comedies","Kids rule in a place called Harvey Street, where a trio of girls right wrongs, ice cream is always an option, and every day feels like Saturday."
TV Show,COMEDIANS of the world,None Listed,"Neal Brennan, Chris D'Elia, Nicole Byer, Nick Swardson, DeAnne Smith, Ivan Decker, Dave Merheje, K. Trevor Wilson, Joel Dommett, Mae Martin, Nish Kumar, Ellie Taylor, Urzila Carlson, Joel Creasey, Nazeem Hussain, Cal Wilson, Riaad Moosa, Tumi Morake, Loyiso Gola, Loyiso Madinga, Atul Khatri, Aditi Mittal, Amit Tandon, Franco Escamilla, Hugo El Cojo Feliz, Gaby Llanas, Enissa Amani, Ilka Bessin, Kaya Yanar, Thiago Ventura, Mhel Merrer, Afonso Padilha, Shirley Souagnon, Jason Brokerss, Tania Dutel, Donel Jack'sman, Ibraheem Alkhairallah, Rawsan Hallak, Adi Khalefa, Moayad Alnefaie, Louis-José Houde, François Bellefeuille, Katherine Levac, Adib Alkhalidey, Martijn Koning, Soundos El Ahmadi, Rayen Panday",United States,2019,TV-MA,13 Seasons,"Stand-Up Comedy & Talk Shows, TV Comedies",This global stand-up comedy series features a diverse set of comics from 13 regions bringing their perspectives on what's funny around the world.
TV Show,Big Mouth,None Listed,"Nick Kroll, John Mulaney, Jessi Klein, Jason Mantzoukas, Jenny Slate, Fred Armisen, Maya Rudolph, Jordan Peele",United States,2019,TV-MA,3 Seasons,TV Comedies,Teenage friends find their lives upended by the wonders and horrors of puberty in this edgy comedy from real-life pals Nick Kroll and Andrew Goldberg.
