type,title,director,cast,country,release_year,content_rating,duration,genre,description
Movie,Winter's Bone,Debra Granik,"Jennifer Lawrence, John Hawkes, Kevin Breznahan, Dale Dickey, Garret Dillahunt, Sheryl Lee, Lauren Sweetser, Tate Taylor",United States,2010,R,100 min,"Dramas, Independent Movies","In this unflinching noir drama, a resilient teen goes on the trail of her missing, drug-dealing father when his absence threatens the family's safety."
Movie,Blue Valentine,Derek Cianfrance,"Ryan Gosling, Michelle Williams, Faith Wladyka, John Doman, Mike Vogel, Ben Shenkman, Jen Jones, Maryann Plunkett, Marshall Johnson, James Benatti, Barbara Troy, Carey Westbrook, Enid Graham",United States,2010,R,112 min,"Dramas, Independent Movies, Romantic Movies","As Cindy and Dean muddle through their languishing marriage, they hearken back to the golden days when life was filled with possibility and romance."
Movie,The Company Men,John Wells,"Ben Affleck, Chris Cooper, Kevin Costner, Tommy Lee Jones, Maria Bello, Rosemarie DeWitt, Craig T. Nelson, John Doman, Tonye Patano, Cady Huffman",United States,2010,R,105 min,"Dramas, Independent Movies",A successful businessman comes face-to-face with America's downsizing epidemic when he loses his job and is forced to take a construction gig.
Movie,The Book of Eli,"Albert Hughes, Allen Hughes","Denzel Washington, Gary Oldman, Mila Kunis, Ray Stevenson, Jennifer Beals, Evan Jones, Joe Pingue, Frances de la Tour, Michael Gambon, Tom Waits",United States,2010,R,118 min,"Action & Adventure, Sci-Fi & Fantasy","Determined to protect a sacred text that promises to save humanity, Eli goes on a quest westward across the barren, postapocalyptic country."
Movie,Skyline,"Colin Strause, Greg Strause","Eric Balfour, Scottie Thompson, Brittany Daniel, Crystal Reed, Neil Hopkins, David Zayas, Donald Faison, Robin Gammell, Tanya Newbould, J. Paul Boehmer",United States,2010,PG-13,94 min,"Action & Adventure, Sci-Fi & Fantasy","After a wild night of partying, Terry discovers that he's one of the few people left on Earth, then sets out to solve the mystery of what happened."
Movie,The Fighter,David O. Russell,"Mark Wahlberg, Christian Bale, Amy Adams, Melissa Leo, Jack McGee, Melissa McMeekin, Bianca Hunter, Erica McDermott, Dendrie Taylor, Jill Quigg, Kate B. O'Brien, Sugar Ray Leonard",United States,2010,R,116 min,"Dramas, Sports Movies","After a string of defeats, a boxer rediscovers his fighting will with help from his trainer and half-brother, a once-talented pugilist."
Movie,Dinner for Schmucks,Jay Roach,"Steve Carell, Paul Rudd, Zach Galifianakis, Jemaine Clement, Jeff Dunham, Bruce Greenwood, Ron Livingston, Chris O'Dowd, Lucy Punch, Stephanie Szostak, David Walliams, Larry Wilmore",United States,2010,PG-13,115 min,Comedies,The host of a dinner party invites his friends to bring the saddest loser they can find. But the ultimate schmuck turns everyone else into the losers.
Movie,Shelter,"Måns Mårlind, Björn Stein","Julianne Moore, Jonathan Rhys Meyers, Jeffrey DeMunn, Frances Conroy, Nate Corddry, Brooklynn Proulx, Brian Anthony Wilson, Joyce Feurring, Steven Rishard, Charles Techman",United States,2010,R,112 min,"Horror Movies, Thrillers",A forensic psychiatrist has to think outside the box when she takes on a patient whose multiple personalities lead to a trail of murder victims.
Movie,Burlesque,Steve Antin,"Cher, Christina Aguilera, Alan Cumming, Eric Dane, Cam Gigandet, Julianne Hough, Peter Gallagher, Kristen Bell, Stanley Tucci, Dianna Agron",United States,2010,PG-13,119 min,"Dramas, Romantic Movies","After leaving Iowa with stars in her eyes, Ali arrives at a Los Angeles burlesque lounge with dreams of taking the stage with her soaring voice."
Movie,Kung Fu Panda: Holiday,Tim Johnson,"Jack Black, Angelina Jolie, Dustin Hoffman, Jackie Chan, Seth Rogen, Lucy Liu, David Cross, James Hong, Dan Fogler",United States,2010,TV-PG,26 min,"Children & Family Movies, Comedies","As preparations for the Winter Feast build, Po is caught between his obligations as the Dragon Warrior and his family holiday traditions."
Movie,My Sister's Keeper,Nick Cassavetes,"Cameron Diaz, Abigail Breslin, Alec Baldwin, Jason Patric, Sofia Vassilieva, Joan Cusack, Heather Wahlquist, Thomas Dekker, Evan Ellingson, David Thornton",United States,2009,PG-13,109 min,Dramas,A former defense attorney finds herself back in court when she and her husband are sued for medical emancipation by their 11-year-old daughter.
Movie,Brooklyn's Finest,Antoine Fuqua,"Richard Gere, Don Cheadle, Ethan Hawke, Wesley Snipes, Will Patton, Lili Taylor, Michael Kenneth Williams, Brían F. O'Byrne, Shannon Kane, Ellen Barkin, Vincent D'Onofrio, Logan Marshall-Green",United States,2009,R,133 min,"Dramas, Thrillers","Three cops find themselves hurtling toward the same crime scene on one fatal night in this tense, edge-of your-seat thriller."
Movie,My Suicide,David Lee Miller,"Gabriel Sunday, David Carradine, Mariel Hemingway, Brooke Nevin, Nora Dunn, Michael Welch, Zachary Ray Sherman, Vanessa Lengies, Tony Hale, Joe Mantegna",United States,2009,NR,111 min,"Comedies, Dramas, Independent Movies","After declaring that he's going to film himself committing suicide for a school project, Archie videotapes reactions from friends and family."
Movie,"The Goods: Live Hard, Sell Hard",Neal Brennan,"Jeremy Piven, Ving Rhames, James Brolin, David Koechner, Kathryn Hahn, Ed Helms, Jordana Spiro, Tony Hale, Ken Jeong, Rob Riggle, Kristen Schaal, Alan Thicke, Jonathan Sadowski, Joey Kern, Craig Robinson",United States,2009,R,89 min,Comedies,"Hired to rescue a flagging car dealership during a major sale, a fast-talking closer spends his days on the lot and his nights at local strip clubs."
Movie,Splatter,Joe Dante,"Corey Feldman, Tony Todd, Tara Leigh, Erin Way, Mark Alan, Stuart Pankin",United States,2009,TV-14,29 min,Horror Movies,"After committing suicide, a washed-up rocker returns from the grave to torment the five people who betrayed him in life."
Movie,A Single Man,Tom Ford,"Colin Firth, Julianne Moore, Nicholas Hoult, Ginnifer Goodwin, Matthew Goode, Paul Butler, Ryan Simpkins, Teddy Sears, Paulette Lamori, Jon Kortajarena",United States,2009,R,100 min,"Dramas, Independent Movies, LGBTQ Movies",This stream-of-consciousness drama centers on a day in the life of a gay college professor who's reeling from his longtime lover's recent death.
Movie,Invictus,Clint Eastwood,"Morgan Freeman, Matt Damon, Tony Kgoroge, Patrick Mofokeng, Matt Stern, Julian Lewis Jones, Adjoa Andoh, Marguerite Wheatley, Leleti Khumalo, Patrick Lyster, Penny Downie",United States,2009,PG-13,134 min,"Dramas, Sports Movies","After the end of apartheid, newly elected President Nelson Mandela uses the 1995 World Cup rugby matches to unite his people in South Africa."
Movie,Coraline,Henry Selick,"Dakota Fanning, Teri Hatcher, John Hodgman, Jennifer Saunders, Dawn French, Keith David, Robert Bailey Jr., Ian McShane",United States,2009,PG,101 min,Children & Family Movies,Curious young Coraline unlocks a door in her family's home and is transported to a universe that strangely resembles her own – only better.
Movie,G-Force,Hoyt Yeatman,"Bill Nighy, Will Arnett, Zach Galifianakis, Kelli Garner, Tyler Patrick Jones, Piper Mackenzie Harris, Gabriel Casseus, Jack Conley, Niecy Nash, Justin Mentell, Nicolas Cage, Sam Rockwell, Jon Favreau, Penélope Cruz, Steve Buscemi, Tracy Morgan",United States,2009,PG,88 min,"Children & Family Movies, Comedies","When a billionaire sets out to take over the world, only one special forces unit can handle the job – a squad of highly trained guinea pigs."
Movie,Hulk Vs.,"Sam Liu, Frank Paur","Fred Tatasciore, Matthew Wolf, Graham McTavish, Grey DeLisle, Kari Wahlgren, Bryce Johnson, Janyse Jaud, Jay Brazeau, Jonathan Holmes, Paul Dobson, Michael Adamthwaite, French Tickner, Nicole Oliver, Qayam Devji, Steve Blum, Mark Acheson, Colin Murdock, Nolan North, Tom Kane",United States,2009,PG-13,83 min,"Action & Adventure, Sci-Fi & Fantasy",This action-packed animated double feature pits the Hulk against two of the Marvel Universe's most powerful characters: Wolverine and Thor.
Movie,The Princess and the Frog,"Ron Clements, John Musker","Anika Noni Rose, Bruno Campos, Keith David, Michael-Leon Wooley, Jennifer Cody, Jim Cummings, Peter Bartlett, Jenifer Lewis, Oprah Winfrey, Terrence Howard, John Goodman, Emeril Lagasse, June Christopher, Paul Briggs, Rob Edwards, John Kassir, Fred Tatasciore, Kimberly Russell, Rif Hutton, Randy Newman, Bridget Hoffman, Corey Burton, Joe Whyte, Michael Colyar, Bruce Smith, Terri Douglas, Claudette Wells, Roger Aaron Brown, Mona Marshall, Terence Blanchard, Kwesi Boakye, Mick Wingert, David Cowgill, Peter Renaday, John Musker, Ritchie Montgomery, Jerry Kernion, Philip Proctor, Eddie Frierson",United States,2009,G,98 min,Children & Family Movies,"In New Orleans during the Jazz Age, a beautiful girl named Tiana has a fateful encounter with frog prince who desperately wants to be human again."
Movie,Paul Blart: Mall Cop,Steve Carr,"Kevin James, Keir O'Donnell, Jayma Mays, Raini Rodriguez, Shirley Knight, Stephen Rannazzisi, Peter Gerety, Bobby Cannavale, Adam Ferrara, Jamal Mixon, Adhir Kalyan, Gary Valentine",United States,2009,PG,91 min,"Action & Adventure, Comedies",An overzealous security guard finds himself in over his head when he tries to thwart a criminal mastermind's plot to rob an entire shopping mall.
Movie,Race to Witch Mountain,Andy Fickman,"Dwayne Johnson, AnnaSophia Robb, Alexander Ludwig, Carla Gugino, Ciarán Hinds, Tom Everett Scott, Chris Marquette, Billy Brown, Christine Lakin, Tom Woodruff Jr., John Kassir, Garry Marshall, John Duff, Ted Hartley, Dave Engfer, Bob Clendenin, Shengyi Huang, Robert Torti, Kim Richards, Brandon Miller, Paul Darnell, Omar Dorsey, Dennis Hayden, Suzanne Krull, Steve Rosenbaum, Andrew Shaifer, Bryan Fogel, Bob Koherr, Sam Wolfson, Beth Kennedy, Corri English, Jonathan Slavin, Kevin Christy, Meredith Salenger",United States,2009,PG,99 min,Children & Family Movies,A sister and brother with special powers are on the run from a mysterious organization that wants to take advantage of the siblings' gifts.
Movie,Friday the 13th,Marcus Nispel,"Jared Padalecki, Danielle Panabaker, Amanda Righetti, Travis Van Winkle, Aaron Yoo, Derek Mears, Jonathan Sadowski, Julianna Guill, Ben Feldman, Arlen Escarpeta, Ryan Hansen",United States,2009,R,97 min,Horror Movies,"A group of teenage camp counselors raises the ire of Jason Voorhees, a masked, homicidal maniac, in this remake of the classic slasher flick."
Movie,Julie & Julia,Nora Ephron,"Meryl Streep, Amy Adams, Stanley Tucci, Chris Messina, Linda Emond, Helen Carey, Mary Lynn Rajskub, Jane Lynch, Joan Juliet Buck",United States,2009,PG-13,123 min,"Comedies, Dramas","In this heartwarming tale, Julie Powell decides to spice up her uneventful life by cooking all 524 recipes outlined in Julia Child's classic cookbook."
Movie,Road Trip: Beer Pong,Steve Rash,"Nestor Aaron Absera, Julianna Guill, Preston Jones, Julia Levy-Boeken, Danny Pudi, Michael Trotter, Daniel Newman, DJ Qualls",United States,2009,R,97 min,Comedies,"When three college pals hit the road to compete in a big-time beer pong tournament, their trip morphs into an outrageous odyssey."
Movie,The Final Destination,David R. Ellis,"Bobby Campo, Shantel VanSanten, Nick Zano, Haley Webb, Mykelti Williamson, Krista Allen, Andrew Fiscella, Justin Welborn, Stephanie Honoré",United States,2009,R,82 min,Horror Movies,"Nick O'Bannon thinks he's cheated death when he keeps a grisly premonition from becoming reality, but he soon realizes that fate has other plans."
Movie,The Invention of Lying,"Ricky Gervais, Matthew Robinson","Ricky Gervais, Jennifer Garner, Jonah Hill, Louis C.K., Jeffrey Tambor, Fionnula Flanagan, Rob Lowe, Tina Fey, Donna Sorbello, Stephanie March",United States,2009,PG-13,99 min,"Comedies, Romantic Movies","In a world where no one fibs, a screenwriter gains fame and fortune – and maybe the girl of his dreams – by saying things that aren't true."
Movie,The Informant!,Steven Soderbergh,"Matt Damon, Scott Bakula, Joel McHale, Melanie Lynskey, Thomas F. Wilson, Patton Oswalt, Tony Hale, Eddie Jemison, Paul F. Tompkins, Tom Papa",United States,2009,R,108 min,"Comedies, Dramas","While gathering evidence against his employer to help the FBI build a price-fixing case, Mark Whitacre begins to piece together a fantasy world."
Movie,The Ugly Truth,Robert Luketic,"Katherine Heigl, Gerard Butler, Eric Winter, John Michael Higgins, Bree Turner, Nick Searcy, Kevin Connolly, Cheryl Hines, Bonnie Somerville, Yvette Nicole Brown, Nate Corddry, Noah Matthews",United States,2009,R,96 min,"Comedies, Romantic Movies","A chauvinistic morning-show commentator tries to prove the relationship theories he espouses on a segment called ""The Ugly Truth."""
Movie,Rachel Getting Married,Jonathan Demme,"Anne Hathaway, Rosemarie DeWitt, Debra Winger, Bill Irwin, Tunde Adebimpe, Mather Zickel, Anna Deavere Smith, Anisa George, Robyn Hitchcock, Sister Carol East, Sebastian Stan",United States,2008,R,113 min,"Dramas, Independent Movies",Longstanding family conflicts resurface when a former model who's been in and out of rehab for a decade returns home for her sister's wedding.
Movie,You Don't Mess with the Zohan,Dennis Dugan,"Adam Sandler, John Turturro, Emmanuelle Chriqui, Nick Swardson, Lainie Kazan, Ido Mosseri, Rob Schneider, Dave Matthews, Michael Buffer, Charlotte Rae",United States,2008,UR,113 min,"Action & Adventure, Comedies",An Israeli counterterrorism soldier with a secretly fabulous ambition to become a Manhattan hairstylist will do anything to make his dreams come true.
Movie,The Haunting of Molly Hartley,Mickey Liddell,"Haley Bennett, Jake Weber, Chace Crawford, Shannon Woodward, Shanna Collins, AnnaLynne McCord, Marin Hinkle, Nina Siemaszko, Josh Stewart, Jessica Lowndes, Randy Wayne",United States,2008,PG-13,85 min,"Horror Movies, Thrillers","A troubled teenage girl hopes to start fresh at a new school, but the horrifying truth about her past is destined to catch up with her."
Movie,Defiance,Edward Zwick,"Daniel Craig, Liev Schreiber, Jamie Bell, Alexa Davalos, Allan Corduner, Mark Feuerstein, Tomas Arana, Jodhi May, Kate Fahy, Iddo Goldberg, George MacKay, Iben Hjejle, Martin Hancock, Jacek Koman, Ravil Isyanov",United States,2008,R,137 min,"Action & Adventure, Dramas","In this action-packed drama based on an extraordinary true story, four brothers protect more than 1,000 Jewish refugees during World War II."
Movie,Mad Money,"Callie Khouri, Jesse V. Johnson","Diane Keaton, Queen Latifah, Katie Holmes, Ted Danson, Roger Cross, Adam Rothenberg, Stephen Root, Christopher McDonald, Meagen Fay, J.C. MacKenzie, Finesse Mitchell, Eric Keenleyside",United States,2008,PG-13,99 min,Comedies,A woman joins the janitorial staff of the Federal Reserve Bank and conspires with two co-workers to pilfer old money that's scheduled to be destroyed.
Movie,Step Brothers,Adam McKay,"Will Ferrell, John C. Reilly, Mary Steenburgen, Richard Jenkins, Adam Scott, Kathryn Hahn, Andrea Savage, Lurie Poston, Elizabeth Yozamp, Logan Manus, Rob Riggle",United States,2008,R,98 min,Comedies,"Brennan and Dale might be grown men, but that doesn't stop a childish sibling rivalry from erupting after Brennan's mom marries Dale's dad."
Movie,Vantage Point,Pete Travis,"Dennis Quaid, Matthew Fox, Forest Whitaker, Bruce McGill, Edgar Ramírez, Saïd Taghmaoui, Ayelet Zurer, Zoe Saldana, Sigourney Weaver, William Hurt",United States,2008,PG-13,90 min,Action & Adventure,"Moments after he arrives in Spain for an antiterrorism summit, U.S. President Ashton is shot."
Movie,Bedtime Stories,Adam Shankman,"Adam Sandler, Keri Russell, Guy Pearce, Russell Brand, Richard Griffiths, Jonathan Pryce, Courteney Cox, Lucy Lawless, Teresa Palmer, Aisha Tyler, Laura Ann Kesling, Jackie Sandler, Lorna Scott, Dana Min Goodman, Andrew Collins, Jonathan Loughran, Jonathan Morgan Heit, Nick Swardson, Tim Herlihy, Billy Tyler, Johntae Lipscomb, Mikey Post, Sebastian Saraceno, Bill Romanowski, Sadie Sandler, Carmen Electra, Allen Covert, Kathryn Joosten, Annalise Basso, Blake Clark, Julia Lea Wolov, Sarah G. Buxton",United States,2008,PG,100 min,"Children & Family Movies, Comedies",Skeeter's life is turned upside down when the fantastical stories he makes up to entertain his niece and nephew inexplicably turn into reality.
Movie,The Spiderwick Chronicles,Mark Waters,"Freddie Highmore, Mary-Louise Parker, Sarah Bolger, Joan Plowright, David Strathairn, Nick Nolte, Seth Rogen, Andrew McCarthy, Martin Short",United States,2008,PG,97 min,Children & Family Movies,"When city-raised twins move to a tumbledown country mansion, it's quite an adjustment – especially after they uncover a magical fantasy world."
Movie,Righteous Kill,Jon Avnet,"Robert De Niro, Al Pacino, 50 Cent, Carla Gugino, John Leguizamo, Donnie Wahlberg, Brian Dennehy, Trilby Glover",United States,2008,R,101 min,"Dramas, Thrillers","Two detectives investigate a rash of vigilante killings linked to an old case, suggesting they might have put an innocent man behind bars."
Movie,Bolt,"Byron Howard, Chris Williams","John Travolta, Miley Cyrus, Susie Essman, Mark Walton, Malcolm McDowell, James Lipton, Greg Germann, Diedrich Bader, Nick Swardson, J.P. Manoux, Dan Fogelman, Kari Wahlgren, Chloë Grace Moretz, Randy Savage, Ronn Moss, John DiMaggio, Daran Norris, Jeff Bennett, Brian Stepanek, Todd Cummings",United States,2008,PG,99 min,"Children & Family Movies, Comedies","This tale follows German shepherd Bolt, a canine actor who makes a cross-country trek when he's mistakenly shipped from Hollywood to New York City."
Movie,Smart People,Noam Murro,"Dennis Quaid, Sarah Jessica Parker, Thomas Haden Church, Ellen Page, Ashton Holmes, Christine Lahti, Camille Mana, David Denman, Don Wadsworth, Robert Haley",United States,2008,R,95 min,"Comedies, Dramas, Independent Movies",An unexpected romance and a surprise visit from his wild brother turn the life of widowed professor Lawrence Wetherhold upside down.
Movie,Frozen River,Courtney Hunt,"Melissa Leo, Misty Upham, Charlie McDermott, Michael O'Keefe, Mark Boone Junior, James Reilly, Jay Klaitz, John Canoe, Dylan Carusona, Michael Sky",United States,2008,R,97 min,"Dramas, Independent Movies","On a Mohawk reservation on the Canadian border, Ray Eddy teams with a widowed tribe member to smuggle illegal immigrants into the United States."
Movie,Traitor,Jeffrey Nachmanoff,"Don Cheadle, Guy Pearce, Saïd Taghmaoui, Neal McDonough, Alyy Khan, Archie Panjabi, Raad Rawi, Jeff Daniels, Lorena Gale, Simon Reynolds, Jonathan Walker, Mozhan Marnò, Tom Barnett, Scali Delpeyrat",United States,2008,PG-13,114 min,"Dramas, Thrillers",An FBI agent assigned to pursue an ex-Special Ops soldier who joined a terrorist organization begins to question his target's true intentions.
Movie,21,Robert Luketic,"Jim Sturgess, Kevin Spacey, Kate Bosworth, Aaron Yoo, Liza Lapira, Jacob Pitts, Laurence Fishburne, Jack McGee, Josh Gad, Sam Golzari, Helen Carey, Jack Gilpin",United States,2008,PG-13,123 min,Dramas,A brilliant group of students become card-counting experts with the intent of swindling millions out of Las Vegas casinos by playing blackjack.
Movie,Milk,Gus Van Sant,"Sean Penn, Emile Hirsch, Josh Brolin, Diego Luna, James Franco, Alison Pill, Victor Garber, Denis O'Hare, Joseph Cross, Stephen Spinella, Lucas Grabeel, Brandon Boyce",United States,2008,R,128 min,"Dramas, Independent Movies, LGBTQ Movies","Sean Penn stars in this biopic about Harvey Milk, the openly gay San Francisco politician who was murdered by a disgruntled city supervisor in 1978."
Movie,Seven Pounds,Gabriele Muccino,"Will Smith, Rosario Dawson, Woody Harrelson, Michael Ealy, Barry Pepper, Elpidia Carrillo, Robinne Lee, Joe Nunez, Bill Smitrovich, Tim Kelleher, Gina Hecht, Andy Milder, Judyann Elder, Sarah Jane Morris",United States,2008,PG-13,123 min,"Dramas, Romantic Movies","Weighed down by a dark secret, IRS agent Ben Thomas tries to improve the lives of seven strangers in need of a second chance."
Movie,R.L. Stine's Mostly Ghostly,Richard Correll,"Madison Pettis, Sterling Beaumon, Luke Benward, Brian Stepanek, David DeLuise, Kim Rhodes, Adam Hicks, Ali Lohan, Sabrina Bryan, Rachel Winfree, Diego Acuña",United States,2008,PG,98 min,"Children & Family Movies, Comedies","After discovering a pair of young ghosts, a nebbish 11-year-old agrees to help the sibling spirits solve the mystery surrounding their demise."
Movie,Get Smart,Peter Segal,"Steve Carell, Anne Hathaway, Dwayne Johnson, Alan Arkin, Terence Stamp, Terry Crews, David Koechner, James Caan, Masi Oka, Nate Torrence, Bill Murray",United States,2008,PG-13,110 min,"Action & Adventure, Comedies","When the identities of secret agents are compromised, hapless Maxwell Smart teams with far more capable Agent 99 to thwart an evil terrorist group."
Movie,Mr. Woodcock,Craig Gillespie,"Billy Bob Thornton, Seann William Scott, Ethan Suplee, Melissa Sagemiller, Susan Sarandon, Melissa Leo, Bill Macy, Kurt Fuller, Amy Poehler",United States,2007,PG-13,88 min,Comedies,"When a self-help author learns that his mother has fallen for his sadistic high school gym teacher, he tries to put a stop to their budding romance."
Movie,No Reservations,Scott Hicks,"Catherine Zeta-Jones, Aaron Eckhart, Abigail Breslin, Patricia Clarkson, Jenny Wade, Bob Balaban, Brían F. O'Byrne, Lily Rabe",United States,2007,PG,104 min,"Comedies, Romantic Movies","Kate, an uptight chef, finds her life turned upside down when her sister dies in a car accident and she becomes her niece's sole guardian."
Movie,Ocean's Thirteen,Steven Soderbergh,"George Clooney, Brad Pitt, Matt Damon, Andy Garcia, Don Cheadle, Bernie Mac, Ellen Barkin, Al Pacino, Casey Affleck, Scott Caan",United States,2007,PG-13,122 min,"Action & Adventure, Comedies",This entry in the all-star caper franchise finds debonair con man Danny Ocean and his gang taking revenge on a double-crossing Las Vegas kingpin.
Movie,The Bucket List,Rob Reiner,"Jack Nicholson, Morgan Freeman, Sean Hayes, Beverly Todd, Alfonso Freeman, Rob Morrow, Rowena King, Christopher Stapleton, Ian Anthony Dale, Richard McGonagle",United States,2007,PG-13,97 min,"Comedies, Dramas",Two terminally ill men bust out of the cancer ward with a plan to experience life to the fullest before they kick the bucket.
Movie,Black Snake Moan,Craig Brewer,"Samuel L. Jackson, Christina Ricci, Justin Timberlake, S. Epatha Merkerson, John Cothran, David Banner, Michael Raymond-James, Adriane Lenox, Kim Richards, Neimus K. Williams",United States,2007,R,116 min,"Dramas, Independent Movies","Lazarus finds Rae beaten and near death, and acts as a father figure to help redeem her. But before saving anyone, Lazarus must face his own demons."
Movie,Code Name: The Cleaner,Les Mayfield,"Cedric the Entertainer, Lucy Liu, Nicollette Sheridan, Mark Dacascos, Callum Keith Rennie, DeRay Davis, Niecy Nash, Will Patton",United States,2007,PG-13,91 min,"Action & Adventure, Comedies",A mild-mannered janitor duped into believing he's an undercover agent stumbles into an international arms ring plot involving the CIA and the FBI.
Movie,Spider-Man 3,Sam Raimi,"Tobey Maguire, Kirsten Dunst, James Franco, Thomas Haden Church, Topher Grace, Bryce Dallas Howard, Rosemary Harris, J.K. Simmons, James Cromwell, Theresa Russell, Dylan Baker, Bill Nunn, Bruce Campbell, Elizabeth Banks",United States,2007,PG-13,139 min,"Action & Adventure, Sci-Fi & Fantasy",The seemingly invincible Spider-Man goes up against an all-new crop of villains in the third installment of the blockbuster adventure series.
Movie,The Brave One,Neil Jordan,"Jodie Foster, Terrence Howard, Naveen Andrews, Carmen Ejogo, Nicky Katt, Mary Steenburgen, Lenny Venito, Zoë Kravitz, Jane Adams, Gordon MacDonald",United States,2007,R,122 min,"Dramas, Thrillers",New York City radio host Erica Bain decides to take the law into her own hands after losing her fiancé in a brutal Central Park attack.
Movie,Next,Lee Tamahori,"Nicolas Cage, Julianne Moore, Jessica Biel, Thomas Kretschmann, Tory Kittles, José Zúñiga, Jim Beaver, Jason Butler Harner, Michael Trucco, Enzo Cilenti",United States,2007,PG-13,96 min,"Action & Adventure, Sci-Fi & Fantasy",Las Vegas magician Cris can see a few minutes into the future and an FBI agent wants his help thwarting a nuclear attack.
Movie,Paranormal Activity,Oren Peli,"Katie Featherston, Randy McDowell, Amber Armstrong, Mark Fredrichs, Micah Sloat, Ashley Palmer, James Piper",United States,2007,R,86 min,"Horror Movies, Thrillers","When Katie and Micah fear their home may be haunted by a demonic presence, Micah sets up a video camera to document all the action."
Movie,The Dukes of Hazzard: The Beginning,Robert Berlinger,"Randy Wayne, Jonathan Bennett, Joel David Moore, Willie Nelson, April Scott, Harland Williams, Christopher McDonald, Hal Williams, Sherilyn Fenn, Gary Cole",United States,2007,R,95 min,"Action & Adventure, Comedies","The mischievous Duke boys, Bo and Luke, are sent to live with their Uncle Jesse and cousin Daisy in this prequel movie to the popular TV series."
Movie,Perfect Stranger,James Foley,"Halle Berry, Bruce Willis, Giovanni Ribisi, Richard Portnow, Gary Dourdan, Florencia Lozano, Nicki Aycox, Kathleen Chalfant, Gordon MacDonald, Daniella Van Graas",United States,2007,R,109 min,Thrillers,Ro risks her life to discover the identity of a stranger lurking on the Internet who might hold the answers to her friend's murder.
